weather_id,date_time,city,season,temperature_c,humidity,rain_mm,wind_speed_kmh,visibility_m,weather_condition
5001.0,01/01/2024 12AM,London,Winter,9.443561949117532,29.0,28.999254578399764,34.50017737176807,6230,Clear
5002.0,2024-01-01T01:00Z,,Winter,14.799415736517961,93.0,39.67845948419956,51.08617732058563,5511,Fog
5003.0,01/01/2024 02AM,London,Winter,2.0851316842359697,74.0,46.75273640494814,38.693441683596106,278,Fog
5004.0,01/01/2024 03AM,,Winter,13.723614326858108,,15.766745212124444,27.51711724817494,9801,Fog
5005.0,2024-01-01T04:00Z,London,Winter,14.864365741299828,93.0,45.34818614129903,4.146509785056951,8923,Rain
5006.0,2024-01-01 05:00,London,Winter,1.2669949900653155,75.0,20.18970460038058,48.01960639501046,2980,Fog
5007.0,2024-01-01 06:00,London,Winter,-0.21111359817133746,51.0,31.376953941147807,67.60342731798984,5422,Rain
5008.0,32/15/2024 99:99,London,FoggySeason,34.76241992661274,43.0,31.993020443520358,46.51191570991589,384,Snow
5009.0,01/01/2024 08AM,,Winter,-4.015380536745086,57.0,2.8207267829368057,38.18294348144775,8206,Rain
5010.0,2024-01-01 09:00,London,Winter,-4.996707328647261,20.0,22.426780382100546,,7049,
5011.0,2024-01-01 10:00,,Winter,13.713014704485577,22.0,7.063588190406328,37.42086170585015,7921,Fog
5012.0,01/01/2024 11AM,London,Winter,0.5376638802772993,36.0,25.51315675519682,78.14490257844928,1912,Clear
5013.0,2024-01-01 12:00,,Winter,11.997866547119337,150.0,,27.684014986910288,6728,Snow
5014.0,2024-01-01T13:00Z,London,Winter,-4.416293230884849,78.0,13.673769229606215,46.512981575693516,Unknown,Snow
5015.0,2024-01-01T14:00Z,London,Winter,2.052961593470326,92.0,38.67962346565163,72.72911962830246,72,Clear
5016.0,2024-01-01T15:00Z,London,Winter,7.581271454514461,83.0,40.049612151815,49.935377078281185,6841,Snow
5017.0,01/01/2024 04PM,,Winter,10.947787690278432,23.0,48.81198001628347,55.877367611260034,2689,Clear
5018.0,2024-01-01 17:00,London,Winter,-1.3067429239535855,-10.0,34.57005007608876,61.578417297513056,8144,Rain
5019.0,01/01/2024 06PM,,Winter,13.64671184858786,24.0,35.48905708840912,8.634040205980416,,Clear
5020.0,2024-01-01 19:00,,Winter,14.242475065893462,50.0,34.492798980707946,56.195458115811185,9895,Snow
5021.0,Unknown,London,FoggySeason,21.79183941144914,92.0,7.012223744069123,45.01370911988041,798,Fog
5022.0,01/01/2024 09PM,London,Winter,12.778384132304442,69.0,30.817645492412787,,,Rain
5023.0,01/01/2024 10PM,London,Winter,-1.2350099171645823,37.0,19.624295742069236,28.769692598389724,1533,Fog
5024.0,2024-01-01 23:00,,Winter,12.92318984424844,33.0,31.535653210313598,47.142845623555885,8218,Rain
5025.0,2099-13-40 25:61,London,,9.77297456193146,51.0,17.564278049932202,29.748400512447226,3998,Fog
5026.0,02/01/2024 01AM,London,Winter,,94.0,18.16136017532654,28.190952176987896,9482,Snow
5027.0,2024-01-02T02:00Z,,Winter,3.414152329656277,84.0,20.299719675326607,,9479,Rain
5028.0,2024-01-02 03:00,,Winter,11.467375590051873,27.0,5.452168216218434,45.03294930409987,3292,Fog
5029.0,2024-01-02 04:00,,Winter,-1.3721619094878479,,187.7408077574118,61.36412825473059,4053,
5030.0,2024-01-02T05:00Z,London,Winter,1.5668759408936772,60.0,28.547357978843856,17.790564204886536,7382,Rain
5031.0,02/01/2024 06AM,,Winter,8.630417548353117,,31.812452136557585,6.99477786525911,8676,Clear
5032.0,2024-01-02T07:00Z,London,Winter,12.15140971656033,52.0,38.816171197103614,63.938190068662415,5069,Storm
5033.0,02/01/2024 08AM,London,Winter,8.444027465467341,30.0,48.45081626791436,4.260356151461933,1616,Storm
5034.0,02/01/2024 09AM,London,Winter,-4.901061723452347,50.0,7.85779844545692,28.56307396818721,9587,Fog
5035.0,2024-01-02 10:00,London,Winter,-1.431504733650113,49.0,47.940001159906835,22.506191765107737,5214,Snow
5036.0,2024-01-02T11:00Z,London,Winter,0.94207522739352,64.0,36.56912388704966,64.506555694734,2613,Rain
5037.0,2024-01-02T12:00Z,London,Winter,8.755434781240254,43.0,46.166610194293526,,3168,Storm
5038.0,2024-01-02 13:00,London,Winter,-1.1878159741558747,57.0,179.51880320351407,37.76469754311592,3249,Rain
5039.0,2024-01-02T14:00Z,London,Winter,-4.959841447277544,77.0,,46.87276586426778,3647,Clear
5040.0,2024-01-02T15:00Z,London,Winter,14.917854326640352,96.0,24.54734961853854,19.644790573201032,6669,Snow
5041.0,02/01/2024 04PM,London,Winter,-0.6199860618924564,26.0,44.14929186198786,47.92274475662035,8306,
5042.0,2024-01-02 17:00,London,Winter,-3.1444029005781826,39.0,11.08485152651525,64.83896322891911,4710,Fog
5043.0,02/01/2024 06PM,,Winter,12.047345562065622,94.0,36.08798030871565,20.46408624244016,4139,Rain
5044.0,2024-01-02 19:00,,Winter,10.80856198412386,49.0,19.158926234750272,59.08479344173344,,Snow
5045.0,2024-01-02T20:00Z,,Winter,3.021618909903591,94.0,37.37621151190149,35.084615697976716,7258,Fog
5046.0,2024-01-02T21:00Z,,Winter,13.967088561513762,78.0,26.562069501091344,,1496,Fog
5047.0,2024-01-02 22:00,London,Winter,13.350541308027498,95.0,3.523087996092533,,194,Snow
5048.0,2024-01-02T23:00Z,London,Winter,,26.0,8.515072906522608,10.677218256973058,7244,Snow
5049.0,2024-01-03T00:00Z,London,Winter,12.689427500041841,84.0,47.614502539161066,37.18026711472113,3066,Rain
5050.0,2024-01-03T01:00Z,,Winter,2.4015947830016877,29.0,34.40685951900377,27.900988251408414,7868,Snow
5051.0,03/01/2024 02AM,London,Spring,7.510313917335749,81.0,23.961905112833982,55.07653677098734,6584,Fog
5052.0,2024-01-03T03:00Z,London,Winter,11.642229399219254,-10.0,5.129253592988031,40.09444536188076,9531,
5053.0,2024-01-03T04:00Z,,Winter,9.07995812577325,58.0,28.89695749116515,41.66557031436458,4464,Clear
5054.0,2024-01-03 05:00,,Winter,7.709192273260131,35.0,16.795058553724008,49.58036878191015,3096,Rain
5055.0,2024-01-03 06:00,,Winter,6.435630860944773,21.0,8.324073933500292,13.357992544714943,6234,Clear
5056.0,03/01/2024 07AM,London,Spring,8.63720522272719,98.0,14.505615100392404,52.69289246578243,6500,Rain
5057.0,2024-01-03 08:00,London,Winter,9.479408164311419,,4.08106553045498,,5567,Snow
5058.0,03/01/2024 09AM,,Spring,18.632071329048113,77.0,28.338895583342065,8.983711712984643,6699,Fog
5059.0,,,,23.130710145120496,20.0,2.1197760981752967,78.93024912245694,6034,Snow
5060.0,2024-01-03T11:00Z,,Winter,8.108993256223824,71.0,8.375032393222437,71.72142610671165,8989,
5061.0,03/01/2024 12PM,London,Spring,7.08425643927238,32.0,3.0034962409778543,79.82535180637353,1510,
5062.0,2024-01-03 13:00,London,Winter,5.224237057974712,52.0,26.104245757313787,74.38935752909859,187,Storm
5063.0,2024-01-03 14:00,London,Winter,1.1613908678371736,98.0,32.58973825967873,52.321822791492764,6616,
5064.0,2024-01-03T15:00Z,London,Winter,-3.6961761096023937,34.0,40.2627138411382,63.44948027225595,254,Fog
5065.0,2024-01-03 16:00,London,Winter,-3.317165045002577,96.0,42.89786951741003,51.92583244457906,3490,Fog
5066.0,2024-01-03T17:00Z,London,Winter,9.01483493069097,82.0,7.077481407606811,21.578601627944074,4112,Storm
5067.0,2024-01-03T18:00Z,London,Winter,-2.3041749010287593,97.0,40.63995495752506,50.05443574197754,9416,Rain
5068.0,2024-01-03 19:00,,Winter,4.701309340063425,55.0,19.522204599126606,59.003874545608646,4676,Rain
5069.0,2024-01-03 20:00,,Winter,-4.924138747195823,42.0,46.07573686998237,75.15493588429612,2391,Storm
5070.0,2024-01-03T21:00Z,London,Winter,14.121103046609495,45.0,13.335055450531641,5.448449232954742,8162,Rain
5071.0,2024-01-03 22:00,London,Winter,4.11982136715233,-10.0,8.305723735109783,200.44399612492074,9920,
5072.0,2024-01-03 23:00,,Winter,-3.5961953498012122,52.0,46.54623999649318,51.666537094018,2434,Fog
5073.0,2024-01-04T00:00Z,,Winter,14.738381340600963,77.0,49.3950687132951,7.396019589323695,5304,Storm
5074.0,2024-01-04 01:00,London,Winter,11.89692044423117,55.0,14.726670551088889,41.103318703664954,2917,Clear
5075.0,04/01/2024 02AM,,Spring,,84.0,14.893339219464114,,661,
5076.0,04/01/2024 03AM,,Spring,18.188301227938368,55.0,33.186952480731236,16.993921091958413,3982,Storm
5077.0,2024-01-04 04:00,,Winter,8.562327302748239,26.0,13.414661058203952,49.066078324898555,4103,
5078.0,2024-01-04T05:00Z,London,Winter,6.375076612006412,100.0,,43.04189711430289,7561,Storm
5079.0,04/01/2024 06AM,London,Spring,11.902758139085211,25.0,6.072122793995305,22.605759002186137,6970,
5080.0,2024-01-04 07:00,London,Winter,3.081735767391301,20.0,36.82155406598705,31.876754955528543,5055,Storm
5081.0,,London,,8.625688526770316,82.0,20.875776638490223,62.147140356419335,4448,Rain
5082.0,2024-01-04T09:00Z,,Winter,,49.0,2.9198827754419012,12.328276748366429,,Rain
5083.0,2024-01-04 10:00,,Winter,12.993649397703727,52.0,37.01221520734085,60.21192453612492,2912,Fog
5084.0,2024-01-04T11:00Z,London,Winter,13.882115832936208,20.0,30.337504892404393,27.91993196747547,7502,Clear
5085.0,2024-01-04T12:00Z,London,Winter,4.8806157657991776,93.0,47.07950523301756,272.49301361748024,4922,Rain
5086.0,04/01/2024 01PM,,Spring,5.91254804015904,65.0,23.844924024366325,31.93347331198927,152,Fog
5087.0,2024-01-04 14:00,,Winter,-1.6907401471154504,61.0,5.4754326633467745,,3323,Fog
5088.0,04/01/2024 03PM,,Spring,13.811572230534649,23.0,27.33429648941731,52.58741691173361,1536,Clear
5089.0,2024-01-04T16:00Z,,Winter,12.304559983264191,56.0,7.328442801593016,50.35949294527256,3948,
5090.0,04/01/2024 05PM,London,Spring,15.498470419960066,45.0,25.58305879864854,31.24296793889563,6117,Rain
5091.0,04/01/2024 06PM,,Spring,11.281497934881347,55.0,0.5239538590064929,44.760311196766324,7543,Rain
5092.0,2024-01-04T19:00Z,,Winter,12.463342073496626,20.0,26.845078229197235,46.72529922327052,4504,Storm
5093.0,04/01/2024 08PM,London,Spring,12.70195825754448,80.0,10.146482140450374,211.65523238735733,181,Rain
5094.0,04/01/2024 09PM,London,Spring,5.342519580344453,30.0,,64.28751467396933,3224,Snow
5095.0,2024-01-04 22:00,London,Winter,0.8323371402513491,71.0,49.50818019167386,34.99587692205853,197,Rain
5096.0,2024-01-04 23:00,London,Winter,4.191392296143528,150.0,38.30987599812944,76.89590376696918,1492,Rain
5097.0,05/01/2024 12AM,London,Spring,6.306262301031834,86.0,31.600626656910908,32.424089464319515,6410,Rain
5098.0,2024-01-05 01:00,,Winter,-3.93949423945698,27.0,27.66553606372219,17.01674960431913,2479,Snow
5099.0,2024-01-05T02:00Z,,Winter,14.26546668422542,61.0,5.068871974845251,,7004,
5100.0,2024-01-05 03:00,London,Winter,-3.482104690578336,54.0,19.48873761027986,60.743136157346754,3452,Storm
5101.0,2024-01-05 04:00,,Winter,12.221029231329233,89.0,25.119014886894263,42.79267355803817,6591,Storm
5102.0,2024-01-05 05:00,London,Winter,3.916028918447738,44.0,38.52314683830549,,9864,Storm
5103.0,2024-01-05T06:00Z,,Winter,14.451052460074642,39.0,29.200441966423757,27.8607587447748,7959,Snow
5104.0,05/01/2024 07AM,London,Spring,9.973962984045105,,36.45646349718795,67.60288220947407,92,Snow
5105.0,05/01/2024 08AM,London,Spring,7.793445587843717,90.0,,70.11438866505019,3390,Snow
5106.0,2024-01-05T09:00Z,,Winter,13.52854189584534,84.0,22.897899612134797,22.664291704995712,2577,Snow
5107.0,05/01/2024 10AM,,Spring,11.39422957506082,150.0,41.443784303961934,66.88850861251139,3252,Snow
5108.0,05/01/2024 11AM,London,Spring,13.96325662854654,98.0,15.908740016565087,53.975830890319415,1586,Fog
5109.0,2024-01-05 12:00,,Winter,8.543750534076256,62.0,25.34971724095391,3.0852267504166697,8259,Storm
5110.0,2024-01-05T13:00Z,,Winter,-1.4148700254320712,92.0,12.787421746168398,19.649224194576753,5783,Storm
5111.0,2024-01-05 14:00,London,Winter,1.1630619187670677,38.0,45.18881882927804,68.22390290114961,9309,
5112.0,2024-01-05T15:00Z,London,Winter,2.3347367637308007,26.0,39.87347529439184,56.631510745494566,9995,Clear
5113.0,05/01/2024 04PM,,Spring,60.0,59.0,48.96978975443467,44.01836858475412,8601,Storm
5114.0,05/01/2024 05PM,London,Spring,9.335480056964883,68.0,,48.98720811821836,6777,
5115.0,2024-01-05 18:00,London,Winter,8.413603858201427,28.0,12.171604953404442,43.235224163251544,,Clear
5116.0,05/01/2024 07PM,,Spring,19.147955235058237,24.0,,34.32553133768554,6370,Fog
5117.0,05/01/2024 08PM,London,Spring,17.458153410796985,34.0,,200.14430652417815,2104,
5118.0,2024-01-05T21:00Z,,Winter,8.915321137650432,96.0,44.12578791582192,57.42026541229352,8285,
5119.0,05/01/2024 10PM,,Spring,6.372628646296271,42.0,42.734282478108106,5.957902449819379,8476,
5120.0,2024-01-05 23:00,,Winter,4.356885082587631,96.0,37.83149081141489,27.014147611928543,8824,Fog
5121.0,2024-01-06 00:00,London,Winter,12.385050912243251,24.0,9.389271494090934,53.480388981808325,2689,Storm
5122.0,2024-01-06 01:00,,Winter,9.437063612003918,23.0,48.15960386620987,42.08383907723064,4701,Snow
5123.0,2024-01-06T02:00Z,London,Winter,12.684830790486469,80.0,38.28062919157066,29.111059546343814,389,
5124.0,06/01/2024 03AM,London,Summer,25.29262087601056,74.0,6.217085831227576,79.81049373136015,7771,Clear
5125.0,06/01/2024 04AM,,Summer,20.14637435537056,73.0,47.31067127054128,30.613977872831015,6186,Storm
5126.0,2024-01-06 05:00,,Winter,9.52112409366395,97.0,5.851682681442916,55.79500599281657,3499,Snow
5127.0,2024-01-06 06:00,,Winter,0.8033048120305208,34.0,47.582575184117985,70.21339496224472,109,Clear
5128.0,2024-01-06 07:00,London,Winter,9.646822766262577,70.0,22.76632060417866,,7367,Snow
5129.0,2024-01-06 08:00,,Winter,4.391291068345991,71.0,32.22283635896731,42.39659044807765,8937,Rain
5130.0,06/01/2024 09AM,London,Summer,25.908759965561877,,42.85735981655318,12.220426108526645,1267,Clear
5131.0,06/01/2024 10AM,London,Summer,31.600700012179487,78.0,28.613787793057995,41.990644215819316,4764,
5132.0,06/01/2024 11AM,,Summer,23.19260431948188,60.0,10.504581241665145,,5647,
5133.0,2024-01-06T12:00Z,,Winter,8.188185394994107,61.0,4.65531887155829,30.137265287628956,427,Clear
5134.0,2024-01-06T13:00Z,,Winter,14.95592744526079,70.0,37.44854158790971,72.49528454789663,5873,
5135.0,2024-01-06T14:00Z,,Winter,-1.2265812909847895,31.0,8.095916574013906,33.477171887203056,7740,Clear
5136.0,2024-01-06 15:00,,Winter,-1.2088627352727377,84.0,45.8410488167274,15.598666350265358,,Rain
5137.0,2024-01-06T16:00Z,London,Winter,-2.0817122442053537,71.0,10.77950502325002,68.84045535511763,,
5138.0,2024-01-06 17:00,London,Winter,-3.5640862460197864,84.0,23.04969281883707,11.926446350824307,8231,Storm
5139.0,Unknown,London,FoggySeason,1.801870880566545,55.0,39.198650036063725,65.80481527241615,3346,Storm
5140.0,06/01/2024 07PM,London,Summer,24.98149700716567,29.0,5.815930684350157,34.058072432479555,630,Fog
5141.0,2024-01-06T20:00Z,,Winter,7.73212009522393,87.0,3.5773423642615096,0.3250842673137466,8652,
5142.0,2024-01-06 21:00,,Winter,13.428532180442708,28.0,8.102066470361457,281.0331979452303,3002,Rain
5143.0,32/15/2024 99:99,London,Winter,8.459629067098437,99.0,30.477109398749768,,7296,Fog
5144.0,2024-01-06T23:00Z,London,Winter,,23.0,20.743685093472656,246.9075671287686,2058,
5145.0,2024-01-07T00:00Z,London,Winter,14.238971394037556,58.0,45.37259926607825,27.651310675927974,7308,Clear
5146.0,2024-01-07T01:00Z,,Winter,12.325216119917243,23.0,16.12305748591417,55.61760825160982,6110,
5147.0,2024-01-07T02:00Z,,Winter,8.015449165934598,21.0,,72.85735009221452,3906,Snow
5148.0,2024-01-07T03:00Z,London,Winter,-0.14743322544743798,59.0,5.707342456261472,19.687166657340693,4914,Fog
5149.0,2024-01-07T04:00Z,London,Winter,4.943861165601502,49.0,23.346122781621876,,5644,Snow
5150.0,2024-01-07T05:00Z,London,Winter,-1.7246360368672131,51.0,17.315457487746883,6.220351563010098,1816,Storm
5151.0,2024-01-07T06:00Z,,Winter,6.228982227931878,85.0,48.70139413246954,72.75566647413089,7376,Clear
5152.0,07/01/2024 07AM,,Summer,13.327971055343559,91.0,5.873022339915685,281.3174964371667,3373,Clear
5153.0,07/01/2024 08AM,London,Summer,24.62009008122191,23.0,43.27285760870406,29.767210816048113,5241,Rain
5154.0,07/01/2024 09AM,,Summer,15.705280119399099,62.0,123.09589878249275,26.440853708615126,6276,
5155.0,2024-01-07 10:00,London,Winter,,29.0,48.019345572443,49.99871278067858,5250,Rain
5156.0,2024-01-07T11:00Z,,Winter,6.613805761216797,93.0,3.6019884447533954,0.47908988978122125,7983,Clear
5552.0,07/01/2024 12PM,,Summer,16.943222893692433,,36.18733818458338,34.21337026614215,3636,Rain
5158.0,2024-01-07 13:00,,Winter,2.125901165437205,45.0,48.877718910381304,18.21150935392908,2830,Storm
5159.0,07/01/2024 02PM,,Summer,23.131975847502517,80.0,41.68155535030677,63.92807624245904,8261,Fog
5160.0,2024-01-07 15:00,,Winter,10.124701465721042,86.0,10.39763609926076,43.818883466405666,3088,Snow
5161.0,2024-01-07 16:00,London,Winter,6.067697057517389,89.0,23.821115901189327,49.40840723044006,1551,Fog
5162.0,2024-01-07T17:00Z,,Winter,-2.557028882364243,91.0,17.291884224029534,51.16295550135901,863,Rain
5163.0,2024-01-07T18:00Z,London,Winter,1.9858817436327865,59.0,21.48283658939648,65.22314455820651,6397,Rain
5164.0,2024-01-07 19:00,London,Winter,8.060352378974846,31.0,4.579596818008202,19.17228792553642,9068,Snow
5165.0,2024-01-07 20:00,,Winter,0.6965632591794009,30.0,43.16522357635258,9.545890550003655,7392,Fog
5166.0,2024-01-07 21:00,London,Winter,9.4560530861156,68.0,22.069038088872773,74.34869914731722,6038,Fog
5167.0,32/15/2024 99:99,London,Winter,8.951629149931176,66.0,47.942730568860476,70.1175986740048,5380,Fog
5168.0,2024-01-07T23:00Z,London,Winter,-1.1409215994209854,-10.0,25.831104909874288,19.26460626161387,3043,Storm
5169.0,2024-01-08T00:00Z,,Winter,0.36479690714323443,90.0,6.021419064883138,22.11475495998141,6872,Storm
5170.0,2024-01-08T01:00Z,,Winter,-3.5814389376010203,92.0,9.298710377293167,43.98224385785106,9032,Rain
5171.0,2024-01-08 02:00,,Winter,13.273498911307932,92.0,145.2933476462596,29.938896647595126,NaN,Rain
5172.0,08/01/2024 03AM,,Summer,15.127993839313827,31.0,147.428761756151,12.388988077292842,,Fog
5173.0,08/01/2024 04AM,London,Summer,28.04619269707998,35.0,4.179666627992967,59.60377745171846,2820,Storm
5174.0,2024-01-08 05:00,,Winter,6.76082457040464,29.0,1.0971487529137958,7.634016845397422,410,Storm
5175.0,2024-01-08T06:00Z,,Winter,-3.194876982574255,58.0,48.851276016233456,18.511939908309138,1830,Storm
5176.0,32/15/2024 99:99,London,FoggySeason,7.267658451337869,56.0,,52.23560129061631,5399,
5177.0,08/01/2024 08AM,London,Summer,,63.0,6.690374212128974,32.3455726790051,3624,Rain
5178.0,2024-01-08T09:00Z,,Winter,-0.8354583565399398,,48.28754848248686,69.45174176956094,4316,Fog
5179.0,08/01/2024 10AM,London,Summer,18.711059742220847,56.0,10.007140713779117,1.4145337612812092,1299,Snow
5180.0,08/01/2024 11AM,London,Summer,16.45105390874162,54.0,14.337141675617538,73.6006492837405,,Storm
5181.0,08/01/2024 12PM,,Summer,15.318984745991282,91.0,47.31125988354861,24.23795197245927,8625,Fog
5182.0,2024-01-08T13:00Z,London,Winter,10.080443700163677,87.0,22.32988746275597,57.7749596949825,,Clear
5183.0,08/01/2024 02PM,London,Summer,34.18417449084155,45.0,17.35952842132426,18.580810392216485,8573,Snow
5184.0,2024-01-08 15:00,,Winter,0.8683229019626211,88.0,33.05973622718785,9.865686033037067,5129,Snow
5185.0,08/01/2024 04PM,,Summer,15.7788000301429,92.0,49.74920710566489,47.7430932395827,1865,Storm
5186.0,2024-01-08 17:00,London,Winter,12.757532807206605,31.0,38.58488353919674,32.82654278635239,4326,Storm
5187.0,08/01/2024 06PM,London,Summer,22.957418357547592,23.0,5.6988218164372215,5.159346073780133,1906,Clear
5188.0,2024-01-08 19:00,,Winter,9.521835704744898,46.0,48.998913129439416,18.417612944412454,1022,Fog
5189.0,2024-01-08T20:00Z,,Winter,-0.5482391332180132,88.0,45.32766966471558,57.93813067288905,1194,Clear
5190.0,08/01/2024 09PM,,Summer,11.264699116401227,69.0,4.520895172323508,35.83705705739266,3764,Clear
5191.0,2024-01-08 22:00,London,Winter,3.35736235049694,-10.0,38.55085305691179,18.497797975356853,6004,Snow
5192.0,2024-01-08T23:00Z,London,Winter,-2.2018121099740284,76.0,31.4560237268788,23.56309094020144,,Clear
5193.0,Unknown,London,FoggySeason,-2.1024903040001197,51.0,11.679723509270218,72.42186531688543,1245,Snow
5194.0,2024-01-09 01:00,,Winter,10.575163052378711,48.0,38.104940462511614,73.66530030132435,2549,Clear
5195.0,2024-01-09T02:00Z,London,Winter,4.707616450883476,-10.0,48.97342326384422,70.1323723388049,7697,Snow
5196.0,2024-01-09T03:00Z,,Winter,-30.0,43.0,35.9517532084029,1.5718364502973081,630,
5197.0,2024-01-09T04:00Z,,Winter,-3.862871682777549,87.0,37.894742790458544,,8600,Fog
5198.0,2024-01-09T05:00Z,,Winter,10.145153097313973,44.0,43.32535309876044,59.76827843403386,8126,Snow
5199.0,2024-01-15T99:00Z,London,FoggySeason,32.28580576424571,57.0,24.627226333939,8.677523232114908,5940,Snow
5200.0,2024-01-09 07:00,,Winter,6.370788465045598,29.0,28.44393008058222,37.70367803194925,319,Snow
5201.0,2024-01-09 08:00,London,Winter,2.4282527889576855,88.0,24.90399847145274,51.89310679769994,4529,Snow
5202.0,2024-01-09 09:00,London,Winter,-1.2950707479239187,51.0,30.140636539956024,26.108178784115115,7376,Clear
5203.0,2024-01-09 10:00,,Winter,2.8048779938146424,100.0,42.61301353147024,49.891711420605475,3765,
5204.0,2024-01-09 11:00,London,Winter,9.049685506135681,39.0,21.491755235468556,1.9061367885521907,2559,
5205.0,2024-01-09T12:00Z,London,Winter,7.353253718269343,34.0,10.929532271601538,6.171519546204296,4442,Clear
5206.0,2024-01-09 13:00,,Winter,1.5775501744345348,46.0,11.936696399033892,22.18148830692372,7273,Rain
5207.0,2024-01-09 14:00,,Winter,7.9104764300567965,45.0,44.553247983065994,1.112862502119203,2600,Fog
5208.0,2024-01-09 15:00,,Winter,,53.0,37.6683933248758,45.90345942354698,8778,Snow
5209.0,32/15/2024 99:99,,Winter,-4.723410519400735,67.0,22.605644127602257,225.68849095723516,6440,Clear
5210.0,,,,-2.2967971436696333,46.0,194.30156373236443,45.21830374241614,6890,Snow
5211.0,2024-01-09T18:00Z,London,Winter,6.071205128051158,20.0,8.998423294548786,43.121059709763585,9644,
5212.0,2024-01-09T19:00Z,,Winter,-1.6269023126331184,68.0,16.52358506827765,9.626200339614979,6227,Storm
5213.0,2024-01-09 20:00,,Winter,-3.043363408684452,60.0,19.1853851789547,2.939152177575375,3371,Storm
5214.0,2024-01-09T21:00Z,,Winter,-1.9375468556041264,21.0,4.639329185952457,64.39731556560666,8758,Snow
5215.0,09/01/2024 10PM,London,Autumn,16.7111720373548,38.0,3.5378089625990485,1.1250648766536209,6256,Storm
5216.0,,London,,8.29661599626192,93.0,43.25723018529871,21.921279519051254,7375,Rain
5217.0,2024-01-10T00:00Z,,Winter,-0.2691915143008412,26.0,27.727907459151318,44.19838481218768,,Snow
5218.0,2024-01-10T01:00Z,,Winter,0.6788535678997949,,19.26229193108765,59.24166024988624,6228,Fog
5219.0,10/01/2024 02AM,London,Autumn,5.199511283555247,72.0,16.83144459651997,6.980229974552241,703,Clear
5220.0,2024-01-10 03:00,,Winter,,74.0,19.577982309313136,69.40403625197203,2413,Clear
5221.0,2024-01-10T04:00Z,,Winter,-2.201673473841017,39.0,15.768199814245277,39.89087623575721,8887,Storm
5222.0,2024-01-10 05:00,London,Winter,4.053278325227595,26.0,0.4384056979047035,77.87876923103823,,Clear
5223.0,10/01/2024 06AM,London,Autumn,9.030358399465722,23.0,12.644897091075007,2.7716758906578676,4090,Snow
5224.0,2024-01-10 07:00,,Winter,0.24185038764047917,63.0,33.802265028274334,76.33855941665588,,Rain
5225.0,10/01/2024 08AM,London,Autumn,11.888428452445915,35.0,4.361023938766017,19.52954754993657,3241,Rain
5226.0,2024-01-10T09:00Z,London,Winter,14.133034995330537,95.0,19.13228900081549,32.8466604560726,7510,
5227.0,2024-01-10 10:00,,Winter,14.919490512461532,23.0,39.612794932993054,70.02872322224903,8004,Rain
5228.0,2024-01-10T11:00Z,London,Winter,-2.057601562804192,33.0,22.84328997781344,66.82318232690287,,Clear
5229.0,2024-01-10T12:00Z,,Winter,5.751631614146486,46.0,133.54024428164703,35.25215055876811,5679,Storm
5230.0,10/01/2024 01PM,London,Autumn,10.602701438209834,68.0,21.906597896582014,28.40399022674326,176,Storm
5231.0,2024-01-10 14:00,London,Winter,8.939318062732182,23.0,48.01728842464775,21.976805270030884,2148,Fog
5232.0,10/01/2024 03PM,,Autumn,19.091369790372042,56.0,27.58137120980153,48.70466935549643,1702,Rain
5233.0,10/01/2024 04PM,London,Autumn,8.070223614568803,49.0,35.223214486507565,35.20739106299548,905,Snow
5234.0,2024-01-10 17:00,,Winter,10.888540476611183,38.0,25.264766546439898,63.12017923130033,4818,Storm
5235.0,2024-01-10T18:00Z,London,Winter,6.593512732562463,58.0,5.545963219401218,56.388980649020006,9302,
5236.0,2024-01-10 19:00,,Winter,9.363630310635507,82.0,23.77655691845422,68.58524666715098,1739,
5237.0,32/15/2024 99:99,,FoggySeason,,57.0,6.063645612921653,54.229770858765825,8068,Snow
5238.0,2024-01-10 21:00,London,Winter,5.659530487322943,68.0,16.555607847540177,77.70729289631034,1680,Rain
5239.0,10/01/2024 10PM,,Autumn,14.617309236681946,73.0,13.806814477935786,61.65527783374409,1433,Clear
5240.0,2024-01-10 23:00,London,Winter,12.592301663425186,34.0,8.232196196746782,1.9324478817686863,7887,Clear
5241.0,2024-01-11 00:00,,Winter,7.039955227034815,74.0,42.896335925885104,54.559742760464964,4619,Fog
5242.0,2024-01-11 01:00,,Winter,12.18764618403316,38.0,16.869918739528007,48.127892205268466,3298,Snow
5243.0,2024-01-11T02:00Z,,Winter,0.800671395280343,21.0,21.368853078013533,0.1744671619816529,1387,Storm
5244.0,2099-13-40 25:61,,FoggySeason,2.4347396899243945,78.0,8.991692260002038,59.28314132753401,9185,Storm
5245.0,2024-01-11T04:00Z,,Winter,14.73150964328456,27.0,2.3535949370920517,40.75215566359664,588,Clear
5246.0,11/01/2024 05AM,London,Autumn,11.726415663113452,97.0,33.332149492432386,38.64911084585616,7604,Fog
5247.0,2024-01-11T06:00Z,,Winter,8.729773755115442,39.0,7.6726306464934,2.209806680534774,7398,
5248.0,2024-01-11 07:00,,Winter,11.305108664958173,45.0,10.591284225895714,12.63528622830738,1667,Rain
5249.0,2024-01-11T08:00Z,,Winter,7.755986851089624,98.0,39.55139916718097,27.379877815709797,7984,Fog
5250.0,2024-01-11 09:00,,Winter,7.482127222551211,59.0,10.030755370248151,35.983922459968156,6491,Clear
,2024-01-11 10:00,,Winter,60.0,77.0,18.022562450313657,78.39404422356263,2128,Clear
5252.0,2024-01-11 11:00,,Winter,10.74193959948799,70.0,6.2036687252453815,58.199056445529976,4959,Rain
5253.0,2024-01-11T12:00Z,,Winter,-3.9222651905809003,41.0,,22.074226800974238,921,Rain
5254.0,11/01/2024 01PM,,Autumn,4.651138534553347,90.0,32.932719980367054,40.974663205481576,1867,Rain
5255.0,11/01/2024 02PM,London,Autumn,10.50061007651571,,43.15067064417104,23.095431199662197,4434,Storm
5256.0,11/01/2024 03PM,London,Autumn,6.283554180946604,20.0,24.080852009611455,52.833706826978606,3744,Snow
5257.0,11/01/2024 04PM,London,Autumn,0.43217318681826544,52.0,6.783910643683782,273.72466385792524,4158,Snow
5258.0,2024-01-11T17:00Z,London,Winter,8.879391901538543,86.0,41.52847896286398,24.03592255959083,7733,Clear
5259.0,2024-01-11 18:00,London,Winter,7.061428270553186,93.0,,42.0650159296186,4581,Fog
5260.0,2024-01-11T19:00Z,London,Winter,-0.5588376702288826,98.0,7.80446928053467,55.12867130685831,8611,Clear
5261.0,2024-01-11 20:00,London,Winter,8.750359026619181,41.0,4.654963004097739,54.070799270363274,860,Clear
5262.0,2024-01-11 21:00,,Winter,14.793454401188853,92.0,32.705660745213954,233.29457018395829,5439,Clear
5263.0,11/01/2024 10PM,,Autumn,18.39524087701321,80.0,13.296719955623754,34.67898327866295,1681,Fog
5264.0,2099-13-40 25:61,,Winter,11.511543170399662,34.0,21.611602968821273,19.329105900392854,7696,Storm
5265.0,2024-01-12T00:00Z,,Winter,9.774568419715997,61.0,10.858071908725625,48.26504057239268,5623,Storm
5266.0,12/01/2024 01AM,,Winter,-1.2177745292764275,36.0,19.427856256857982,59.63642820080011,7617,Snow
5267.0,2024-01-12 02:00,London,Winter,2.1545318622340552,46.0,8.47136933048665,16.537818953431447,,Clear
5268.0,12/01/2024 03AM,,Winter,2.318413394641496,58.0,27.68102099456652,70.74779010698579,8945,Rain
5269.0,2024-01-12T04:00Z,London,Winter,14.983782954247214,49.0,1.0979260851126604,23.39102602065008,584,Fog
5270.0,2024-01-12T05:00Z,London,Winter,4.045912414737604,50.0,1.5088549456828193,42.64934037365738,,Storm
5271.0,2024-01-12T06:00Z,London,Winter,-1.7552579334325658,93.0,16.271135757849354,23.007019414567786,2576,Snow
5272.0,2024-01-12T07:00Z,,Winter,-2.6112872167488943,78.0,14.274225032598803,79.95264459220783,9896,Rain
5273.0,12/01/2024 08AM,London,Winter,-4.050401931868965,78.0,39.667183608940945,7.506607467115618,428,Fog
6402.0,2024-01-12 09:00,,Winter,5.880482284054782,52.0,42.60951593690632,34.62628285072277,8682,Fog
5275.0,12/01/2024 10AM,,Winter,-0.41315341629409374,62.0,37.72757567653052,47.38472142586734,1221,Clear
5276.0,12/01/2024 11AM,London,Winter,9.839640961393197,35.0,28.670713868111964,,5336,
5277.0,2024-01-12T12:00Z,London,Winter,0.5401841022677667,20.0,37.83592128980384,57.26617832886564,3140,Snow
5278.0,2024-01-12T13:00Z,,Winter,-4.505490074888829,60.0,9.017847604032836,50.33825291049627,4901,Fog
5279.0,12/01/2024 02PM,London,Winter,13.462216619481843,34.0,45.39704270922192,67.2583688590086,4999,Storm
5280.0,2024-01-12 15:00,London,Winter,0.411238384547965,91.0,24.202243814644692,64.10790717723697,3430,
5281.0,2024-01-12T16:00Z,,Winter,-0.5250590582230803,43.0,34.410949747135874,14.775039110850301,9351,Storm
5282.0,2024-01-12 17:00,,Winter,-3.375588526590352,33.0,2.548793414285222,13.178153339437557,7938,Rain
5283.0,2024-01-12 18:00,London,Winter,10.636524838739343,45.0,44.355185553374206,27.247546685509487,9204,Clear
5284.0,2024-01-12 19:00,,Winter,60.0,64.0,20.027517410291683,50.693376824807885,4546,Clear
5285.0,2024-01-12 20:00,London,Winter,7.83334308208693,97.0,35.58870275524967,4.919284177408967,458,Fog
5286.0,12/01/2024 09PM,London,Winter,6.520588689583224,80.0,36.05574693703672,35.21773993291899,9372,
5287.0,2024-01-12T22:00Z,,Winter,-2.0504852900549664,55.0,9.491559999584975,28.595412897535716,1590,Storm
5288.0,2024-01-12T23:00Z,,Winter,60.0,42.0,20.713094081694205,44.8532083661058,3097,Storm
5289.0,13/01/2024 12AM,,Winter,2.868849233975075,52.0,38.40087697463425,77.33521541329375,3515,Snow
5290.0,2024-01-13T01:00Z,,Winter,12.1185942710351,70.0,28.72215540933335,38.1470128069892,6718,
5291.0,2024-01-13T02:00Z,,Winter,-2.0227492602370134,32.0,27.939036381682698,34.5087925942498,7533,Fog
5292.0,13/01/2024 03AM,,Winter,9.357745704458333,65.0,26.085965932725408,71.90094678005997,4894,Fog
5293.0,13/01/2024 04AM,London,Winter,-2.974596923421693,77.0,43.282924903779055,29.621703253404277,9675,Clear
5294.0,2024-01-13T05:00Z,,Winter,,45.0,15.185222798464704,14.703236364638093,7604,
5295.0,2024-01-13 06:00,,Winter,13.503837858527305,80.0,33.735804864100146,4.6789465441216205,593,Storm
5296.0,13/01/2024 07AM,,Winter,7.445670236073065,54.0,40.09103489548804,32.42249000073974,7760,
5297.0,2024-01-13T08:00Z,London,Winter,10.450235396129697,60.0,26.000207052047873,25.34310366481907,1326,Snow
5298.0,2024-01-13 09:00,London,Winter,12.349309804685983,53.0,23.428915468201474,33.0187728056664,4082,Clear
5299.0,13/01/2024 10AM,,Winter,,92.0,,3.782786298418035,8562,
5300.0,13/01/2024 11AM,,Winter,10.985174662718132,93.0,35.08351130961505,59.45162326892144,2969,Storm
5301.0,2024-01-13T12:00Z,London,Winter,-2.4407910556126033,31.0,14.68490999735555,57.1077525839121,8006,Rain
5302.0,2024-01-13 13:00,,Winter,14.004675028823218,56.0,32.859097723848166,51.6221892643283,7599,Storm
5303.0,13/01/2024 02PM,London,Winter,60.0,,24.36876781785712,48.577187673885724,4205,Rain
5304.0,2024-01-13 15:00,,Winter,1.8749852428993368,30.0,16.92892444677603,70.47454946790884,6466,Snow
5305.0,13/01/2024 04PM,,Winter,-0.023004164185302933,63.0,3.3766902681640287,18.89501352897402,2151,Rain
5306.0,2024-01-13 17:00,,Winter,1.244705194687345,89.0,9.39520127424925,,5964,Storm
5307.0,2024-01-13T18:00Z,,Winter,2.103080304639917,25.0,31.731869015528698,78.70949549489573,6325,Rain
5308.0,2024-01-13T19:00Z,,Winter,-0.530207726744214,-10.0,33.63877987194855,52.23038611100196,4655,Clear
5309.0,2024-01-13T20:00Z,London,Winter,14.944613770819664,91.0,48.899112080136106,74.6498650049136,7954,Snow
5310.0,2099-13-40 25:61,London,,1.5175239019865927,66.0,22.875267736690624,39.654741751295774,9437,Snow
5311.0,13/01/2024 10PM,London,Winter,2.9939564598034885,92.0,,43.827660727519564,6141,
5312.0,2024-01-13T23:00Z,,Winter,-1.9194889782839497,65.0,45.350893439502386,,6365,Snow
5313.0,2024-01-14T00:00Z,London,Winter,9.29679901327098,43.0,1.6531422940522733,40.878142947852574,2905,Rain
5314.0,2024-01-14T01:00Z,London,Winter,,87.0,34.06673048982653,27.333065337699132,1659,Clear
5315.0,14/01/2024 02AM,London,Winter,10.616834321036892,60.0,1.6330764591640623,7.865595312384714,7874,Rain
5316.0,2024-01-14 03:00,,Winter,-3.9620352447364593,90.0,14.00229126162616,70.554073209833,9479,Snow
5317.0,2024-01-14T04:00Z,London,Winter,9.800079333883936,21.0,36.132963640558415,60.07018164074963,4368,
5318.0,2024-01-14T05:00Z,,Winter,1.2665869645315508,88.0,38.88379317092623,27.532310143339565,2217,Storm
5319.0,2024-01-14T06:00Z,,Winter,-3.2559782529915093,61.0,24.218611972263325,45.05912619116606,6538,Snow
5320.0,2024-01-14T07:00Z,,Winter,,,1.7450063910310898,27.966028660583113,5867,Clear
5321.0,2024-01-14 08:00,,Winter,-1.6548866020897357,96.0,35.69433168918342,292.5805069304283,5126,Clear
5322.0,14/01/2024 09AM,London,Winter,2.198508963837482,72.0,29.31713987103289,30.592853696790108,1642,Storm
5323.0,2024-01-14 10:00,,Winter,3.2292350790745097,60.0,39.56246552749474,48.83617581850933,6578,Rain
5324.0,2024-01-14 11:00,London,Winter,0.8401696979961315,68.0,32.605671331068486,241.0114588072062,Unknown,Clear
5325.0,2024-01-14 12:00,,Winter,13.584535430819177,38.0,26.405147985012718,8.114637865680825,NaN,
5326.0,,,,25.309514338457596,95.0,40.02679962274229,,9434,Storm
5327.0,2024-01-14T14:00Z,,Winter,-3.336383711276103,25.0,47.45886753151436,,,
5328.0,14/01/2024 03PM,London,Winter,-2.7185846922160306,74.0,11.821313599348377,42.296130958336505,2251,Clear
5329.0,14/01/2024 04PM,London,Winter,3.410557146866857,56.0,48.08026001798996,55.38474797736727,3368,Storm
5330.0,Unknown,,Winter,-1.9096673144814158,52.0,38.524064480261906,64.04578871550221,885,
5331.0,2024-01-14 18:00,London,Winter,5.477728476406201,,4.296867885061467,45.89385681587263,9584,Clear
5332.0,2024-01-14 19:00,London,Winter,7.323200257188118,49.0,44.5149544978581,3.149284826012,5120,
5333.0,14/01/2024 08PM,,Winter,13.89711242072935,90.0,17.012774786319923,65.24554702291337,NaN,Fog
5334.0,14/01/2024 09PM,London,Winter,1.3999369109589228,45.0,0.9179118630184391,52.60080644461858,5455,Storm
5335.0,14/01/2024 10PM,London,Winter,,,46.60930295285988,15.088520627939932,3122,Rain
5336.0,2024-01-14T23:00Z,London,Winter,-1.1922845487027778,25.0,18.545610540201015,26.410110744203514,6508,Rain
5337.0,2024-01-15T00:00Z,London,Winter,14.170818255839535,44.0,11.832428021327706,29.409433137456737,1894,Clear
5338.0,15/01/2024 01AM,London,Winter,5.417863409432941,48.0,8.402689424950472,22.260751413623723,5097,Snow
5339.0,2024-01-15 02:00,,Winter,6.862612995782838,80.0,27.570468116349904,19.275382280811606,8351,
5340.0,2024-01-15 03:00,,Winter,-4.793844096241897,55.0,29.77693843179226,1.322475666563312,5904,Rain
5341.0,,London,,,60.0,16.445561729457083,47.92653504402044,6621,Snow
5342.0,2024-01-15 05:00,London,Winter,12.36477835362058,47.0,3.315863445399364,30.5286218952857,4614,Fog
5343.0,2024-01-15T06:00Z,London,Winter,6.877866718526933,99.0,32.9815297301798,53.75055946142709,1607,
5344.0,2024-01-15T07:00Z,,Winter,8.447664061339076,30.0,,,,Storm
5345.0,2024-01-15T08:00Z,,Winter,9.489847364078365,71.0,4.511887422133048,62.819029890593406,243,Storm
5346.0,2024-01-15T09:00Z,,Winter,13.652763997311204,49.0,17.229515172768306,3.0973326214819696,7767,Storm
5347.0,2024-01-15T10:00Z,,Winter,-3.4687178960686604,64.0,15.363309614165965,71.29969180945986,5367,Clear
5348.0,2024-01-15 11:00,,Winter,7.872662022342475,97.0,5.922332424580635,72.54372430935562,1178,Clear
5349.0,15/01/2024 12PM,London,Winter,8.79668450966406,63.0,38.530645834458255,62.45657232066773,144,Storm
5350.0,2024-01-15T13:00Z,,Winter,-2.241756109985684,39.0,12.434010264647528,30.420965149178507,1955,Snow
5351.0,15/01/2024 02PM,London,Winter,-1.9740856715719923,62.0,16.361796584625726,29.052696038929533,3236,
5352.0,2024-01-15T99:00Z,,FoggySeason,30.6318440046729,,31.24298209154676,76.45908063386804,248,Clear
5353.0,2024-01-15T16:00Z,London,Winter,5.902994470115367,150.0,172.09130955132994,66.23314637559471,5008,
5354.0,2024-01-15 17:00,,Winter,6.049784911188041,20.0,5.784942679067784,43.531749581331255,2711,
5355.0,2024-01-15T18:00Z,London,Winter,0.3931984582720922,29.0,16.605347464736813,71.49665812304669,2185,Snow
5356.0,2024-01-15 19:00,,Winter,12.603172399209921,39.0,35.501237959882225,,4873,Clear
5357.0,2024-01-15 20:00,London,Winter,14.348471092631051,55.0,39.517013084596584,20.631290801676066,2760,Clear
5358.0,2024-01-15T21:00Z,,Winter,-3.4512506581631697,33.0,48.65170426276493,,4657,Snow
5359.0,15/01/2024 10PM,London,Winter,-30.0,,27.238090679724014,,,
5360.0,2024-01-15 23:00,London,Winter,11.933760025205821,77.0,4.923102318501449,43.58282702332154,5006,Rain
5361.0,16/01/2024 12AM,London,Winter,13.467897024569613,22.0,,71.42541175740264,5288,Fog
5362.0,2024-01-16 01:00,,Winter,11.918608129956176,51.0,124.25412049431775,24.322745696401206,9946,Snow
5363.0,16/01/2024 02AM,,Winter,6.985244475936039,,14.368329432545279,30.36870833329454,5435,Storm
5364.0,2099-13-40 25:61,,Winter,-0.18980149188972728,65.0,46.6780256074304,19.520785815749655,8172,Fog
5365.0,16/01/2024 04AM,London,Winter,14.564104215985331,44.0,35.73656227724837,282.8187901330184,9904,
5366.0,16/01/2024 05AM,London,Winter,8.270446428658897,54.0,19.121867071714014,57.78718846697399,149,Rain
5367.0,2024-01-16T06:00Z,,Winter,7.866166480033794,73.0,17.543134891715773,42.809965022738304,3917,Fog
5368.0,16/01/2024 07AM,,Winter,10.001261515998657,,6.1937809322588135,70.03141374968212,3965,
5369.0,16/01/2024 08AM,London,Winter,13.43467911433632,93.0,49.93943812931001,55.04060433750973,8516,Rain
5370.0,16/01/2024 09AM,London,Winter,9.921818120655036,68.0,146.84270134187653,40.21106903231214,9441,Storm
5371.0,2024-01-16 10:00,London,Winter,-3.5123294542252803,78.0,45.977431831647344,11.433649364878464,3532,Fog
5372.0,2024-01-16 11:00,,Winter,-0.6004872368848595,87.0,19.07011032695125,49.256387090394455,3894,Storm
5373.0,16/01/2024 12PM,,Winter,10.998693039124067,62.0,15.660123306015167,29.259950521263853,4871,Snow
5374.0,2024-01-16T13:00Z,London,Winter,3.081818340477799,54.0,6.183355087222381,21.405107764567592,1264,Fog
5375.0,2024-01-16 14:00,London,Winter,10.176253343444426,50.0,43.064525534170215,232.1000458957721,4652,Snow
5376.0,2024-01-16T15:00Z,,Winter,6.563895850608494,37.0,39.19244189127128,36.04369347230636,1248,Storm
5377.0,2024-01-16T16:00Z,,Winter,13.13004921415564,32.0,10.177229441768837,2.6113889062756535,5916,
5378.0,2024-01-16 17:00,,Winter,1.033654293484867,49.0,14.408639155600461,56.60428623895058,8342,Clear
5379.0,2024-01-16T18:00Z,,Winter,1.8299171890202626,-10.0,44.00619114799452,32.10590969003406,2541,Snow
5380.0,2024-01-16T19:00Z,London,Winter,4.3182362808629176,58.0,47.37374617404947,23.08151171674951,4034,Storm
5381.0,16/01/2024 08PM,London,Winter,-0.5141643630735064,39.0,19.2346102002549,,9463,Storm
5382.0,2024-01-16 21:00,London,Winter,5.461319801902144,47.0,10.949692510223347,22.14727088602018,7237,Fog
5383.0,32/15/2024 99:99,London,Winter,,88.0,40.14433052392707,44.77438507575309,,Storm
5384.0,2024-01-16 23:00,London,Winter,-2.2388389109916584,77.0,39.634627748086,21.374156838202207,2968,Fog
5385.0,17/01/2024 12AM,London,Winter,8.108647746360944,68.0,21.02135183365875,15.271326436010746,,Fog
5386.0,2024-01-17 01:00,,Winter,-3.8245036992422032,28.0,36.76851088489602,78.3974757322132,310,
6114.0,Unknown,,Winter,5.544209694182655,44.0,21.946879060188873,67.87503979234948,1136,Snow
5388.0,2024-01-17 03:00,,Winter,3.4069330173414425,92.0,32.38227567129404,12.017103314089503,3389,Clear
5389.0,2024-01-17 04:00,,Winter,7.6780790951854545,51.0,48.01806139784058,34.56833439690105,5608,Rain
5390.0,2024-01-17T05:00Z,London,Winter,14.26923751484436,44.0,18.969846874536405,54.33163512725095,3660,Snow
5391.0,Unknown,London,Winter,14.490917431293031,97.0,41.677637637508546,74.7540556688329,7278,Fog
5392.0,2024-01-17T07:00Z,London,Winter,12.240808358810892,51.0,32.16088138663151,6.38938419860426,4206,Fog
5393.0,2024-01-17 08:00,,Winter,5.501106582578359,76.0,24.92777373770955,23.507533812167736,316,Clear
5394.0,2024-01-17T09:00Z,London,Winter,6.102782382873492,30.0,47.061232643404686,23.679216933176008,3886,Fog
5395.0,2024-01-17 10:00,London,Winter,10.961708993887555,49.0,9.04584297248589,8.434605405973414,4019,Storm
5396.0,2024-01-17T11:00Z,London,Winter,,98.0,6.015355591625998,,2814,Clear
5397.0,17/01/2024 12PM,London,Winter,10.50196647836989,98.0,13.27661716289661,77.40412888516073,728,
5398.0,17/01/2024 01PM,London,Winter,12.292946329758685,71.0,27.49596648419315,22.184151988553424,5043,Fog
5399.0,2024-01-17 14:00,London,Winter,12.784050431488737,,20.752521397615247,71.6642442990894,9862,Storm
5400.0,2024-01-17T15:00Z,,Winter,9.070860483194096,71.0,7.604704747726926,25.41029965300443,6861,
5401.0,2024-01-17 16:00,London,Winter,-1.413110992122899,,26.332468185807905,19.589610724018335,3915,Snow
5402.0,2024-01-17T17:00Z,,Winter,1.9624846837886922,50.0,25.901392217426828,51.604296771164556,8697,
5403.0,2024-01-17 18:00,London,Winter,2.6974592275869043,-10.0,28.510679734008775,69.20823084405757,5603,Snow
5404.0,2024-01-17 19:00,London,Winter,0.6720978273554508,61.0,3.353570129945338,51.68679744520962,5846,Fog
5405.0,2024-01-17T20:00Z,,Winter,-3.8527584769509526,92.0,22.218836403163213,33.06543738284467,7362,Storm
5406.0,17/01/2024 09PM,,Winter,6.0340592060069635,21.0,47.098582937573,49.28328960799479,4228,Rain
5407.0,2024-01-17T22:00Z,,Winter,0.8160080761489112,88.0,39.03549282141194,292.58310570053925,8477,Storm
5408.0,2024-01-17T23:00Z,,Winter,7.995117179679072,20.0,6.763842317178686,68.8580666239561,645,Fog
5409.0,18/01/2024 12AM,,Winter,13.282294777219143,30.0,25.805641920049826,66.19867018451359,2865,Snow
5410.0,2024-01-18 01:00,London,Winter,13.702212693607699,47.0,47.37867542129763,10.71323877685506,2462,Snow
5411.0,2024-01-18 02:00,,Winter,14.282757540887943,68.0,38.53954658466124,60.38865199426593,7246,Fog
5412.0,2024-01-18 03:00,,Winter,10.777233208929385,57.0,27.808158051656505,42.776303669193595,3528,Storm
5413.0,18/01/2024 04AM,London,Winter,7.024071159623658,78.0,17.402310455785912,28.597571365356984,9582,Storm
5414.0,2024-01-18T05:00Z,London,Winter,-2.826688455321269,71.0,22.49170510137527,28.411719049587838,3689,
5415.0,2024-01-18T06:00Z,London,Winter,8.74471372117296,-10.0,,49.77651555325471,8778,
5416.0,18/01/2024 07AM,London,Winter,14.44569842329459,27.0,4.54656718632534,66.64081551672918,NaN,Snow
5417.0,18/01/2024 08AM,London,Winter,14.217975089273473,39.0,40.71102035675025,41.47456462683942,5291,Rain
5418.0,2024-01-18T09:00Z,,Winter,2.271594656688414,85.0,22.42405347229946,14.72668698555677,5651,Storm
5419.0,,,,17.41564195779031,20.0,30.11743412145737,26.992617139133106,8833,
5420.0,18/01/2024 11AM,,Winter,5.092441676788004,80.0,,69.47072656399465,,Clear
5421.0,18/01/2024 12PM,London,Winter,-0.5868666224539476,,4.5576825921214095,66.09571972026325,6103,Snow
5422.0,18/01/2024 01PM,,Winter,8.528693040797886,,26.91671557811993,63.04924104393038,9909,Clear
5423.0,2024-01-18T14:00Z,London,Winter,1.1058993512986692,34.0,19.287761119902047,262.3957181777511,9164,Storm
5424.0,18/01/2024 03PM,London,Winter,3.971353579202038,71.0,22.729930281736564,63.62640090635309,3480,
5425.0,2024-01-18T16:00Z,,Winter,-0.4516894641537217,150.0,38.24343914813001,0.9274630978927334,6710,Fog
5426.0,18/01/2024 05PM,,Winter,-3.3008364615155616,53.0,37.24858604563457,16.881396313482043,,Clear
5427.0,2024-01-18T18:00Z,,Winter,4.941515536836313,43.0,13.66246294243405,61.693245546343014,,Clear
5428.0,2024-01-18T19:00Z,London,Winter,4.112279493897226,54.0,199.66513548441426,33.166984355017746,7796,Storm
5429.0,2024-01-18T20:00Z,,Winter,8.246783342323553,97.0,4.814417265792825,39.76035017157574,2215,Fog
5430.0,2099-13-40 25:61,London,Winter,5.267848336463079,59.0,22.66031885944463,77.77265469042639,6347,Clear
5431.0,2024-01-18 22:00,London,Winter,-30.0,38.0,,43.966120523812684,4297,Clear
5432.0,2024-01-18 23:00,,Winter,13.476590790487627,69.0,38.87678666481607,9.88839204731308,9904,Rain
5433.0,19/01/2024 12AM,London,Winter,8.096169009230245,87.0,39.93510554210854,8.30364471888461,6271,
5434.0,19/01/2024 01AM,,Winter,1.1533088401436409,69.0,47.194460873812176,69.91534262932176,1621,
5435.0,2024-01-19 02:00,,Winter,2.667658561309074,28.0,21.81998313598078,18.105197994764612,xxx,Snow
5436.0,Unknown,London,,30.738500620270926,80.0,13.36985305993914,68.02249379633481,6040,Snow
5437.0,2024-01-19 04:00,,Winter,-0.12704113694716135,79.0,24.44719061713576,43.455672860977316,9842,Storm
5438.0,19/01/2024 05AM,,Winter,1.3770550069880745,36.0,47.60269730560116,61.36645880089369,6475,
5439.0,2024-01-19 06:00,,Winter,14.86972442324467,41.0,5.61328186940403,24.259240255251953,3825,Snow
5440.0,2024-01-19T07:00Z,,Winter,-2.343366922663208,74.0,47.71041381514851,13.910759305855604,8836,Fog
5441.0,19/01/2024 08AM,London,Winter,13.293980866262483,28.0,10.193650410464844,78.91254360843752,6256,Rain
5442.0,2024-01-19 09:00,,Winter,9.304899201841721,22.0,16.695284482835177,,3580,Rain
5443.0,19/01/2024 10AM,,Winter,0.7300349644678921,37.0,26.078554948391247,28.039026622754804,2841,Fog
5444.0,19/01/2024 11AM,,Winter,3.486459746663389,94.0,0.3837032069070878,,2472,Clear
5445.0,19/01/2024 12PM,,Winter,3.3608683617074053,21.0,15.389044668704411,57.387530275310326,6898,Storm
5446.0,2024-01-19T13:00Z,London,Winter,14.527465292038201,58.0,32.85551559994961,,4397,Rain
5447.0,19/01/2024 02PM,London,Winter,12.06953041955725,69.0,28.20837347037401,53.68846200908507,340,Clear
5448.0,2024-01-19T15:00Z,London,Winter,1.8106067514029895,,,64.41239561614515,1839,Fog
5449.0,2024-01-19 16:00,,Winter,3.4043108200026957,78.0,40.03903328797273,75.1587160282788,3292,Rain
5450.0,2024-01-19 17:00,London,Winter,12.649731278308977,43.0,1.822466061563749,21.270458677535693,2515,Snow
5451.0,19/01/2024 06PM,,Winter,-2.7857855076703752,100.0,4.720639509762931,69.87655152856232,1912,
5452.0,19/01/2024 07PM,,Winter,-0.9653017607205499,73.0,0.3659596352129424,287.7938818406142,,Snow
5453.0,19/01/2024 08PM,,Winter,2.3494234101338467,88.0,35.92648948987702,56.80392958917682,5592,Rain
5454.0,2024-01-19T21:00Z,London,Winter,10.333986761411204,99.0,41.49840068867328,30.194171296950493,933,Storm
5455.0,2024-01-19T22:00Z,,Winter,6.478937698122966,93.0,36.376838572819636,48.79825036378794,,
5456.0,19/01/2024 11PM,,Winter,0.9598161984236402,59.0,,51.273935135525264,7489,Fog
5457.0,2024-01-20T00:00Z,London,Winter,10.719815331495223,90.0,25.080416767057727,54.139705865783974,60,Snow
5458.0,2024-01-20 01:00,,Winter,0.11961105421072649,55.0,20.28123383231651,50.94402108167792,907,Clear
5459.0,2024-01-20T02:00Z,,Winter,9.625756372720339,40.0,2.874328124499298,70.34663521502311,8376,Storm
5460.0,20/01/2024 03AM,London,Winter,3.1191055851004066,54.0,34.14819465400795,36.77243381254867,6714,
5461.0,2024-01-20T04:00Z,,Winter,2.0701248504626264,86.0,1.1410479000863505,71.16602446155854,1022,Storm
5462.0,20/01/2024 05AM,,Winter,2.1464937425508417,-10.0,27.65358911504793,33.313208961146415,8655,Storm
5463.0,20/01/2024 06AM,,Winter,-3.882703336688742,,21.347950040833886,5.2797231363264086,7405,Rain
5464.0,2024-01-20 07:00,London,Winter,-4.548565396219953,57.0,23.903213869496447,46.73194299525144,9518,Storm
5465.0,2024-01-20T08:00Z,,Winter,14.52241976123743,64.0,37.26286468535014,55.04836016422537,7408,Rain
5466.0,2024-01-20 09:00,,Winter,14.482232521687486,34.0,44.32857689969182,13.893331280120087,4157,
5467.0,20/01/2024 10AM,London,Winter,5.119166038256225,,45.08791937095665,32.60447506086664,1652,Fog
5468.0,2024-01-20 11:00,,Winter,14.718092432739084,44.0,5.4253980504662795,76.43424703560655,5105,Snow
5469.0,2024-01-20 12:00,,Winter,13.570285054239125,91.0,20.028936700467398,20.848701037472132,9762,Snow
5470.0,2024-01-20T13:00Z,,Winter,4.550159953337031,34.0,20.517451301542707,4.763520828104291,2055,
5471.0,20/01/2024 02PM,London,Winter,11.132225890837383,33.0,5.942392540795383,62.85135947273106,941,Clear
5472.0,2024-01-20T15:00Z,London,Winter,9.521439079708902,58.0,152.24613115300053,34.09641358832869,5433,Fog
5473.0,2024-01-20T16:00Z,,Winter,-1.3864392530679526,56.0,47.27288927815086,50.13910783813883,,
5474.0,2024-01-20T17:00Z,London,Winter,1.404582697453498,34.0,37.986142358795746,59.00702833312306,4243,Fog
5475.0,2024-01-20 18:00,,Winter,13.36255945992827,44.0,179.41971335829055,21.09357307318035,975,
5476.0,2024-01-20 19:00,London,Winter,-2.983428425615464,64.0,36.48447201840979,35.600599561450004,4782,Rain
5477.0,2024-01-20 20:00,London,Winter,4.967600479298406,63.0,6.9208230556738135,27.158309536934517,2773,
5478.0,2024-01-20T21:00Z,London,Winter,0.03276002112737597,56.0,29.539425899868082,26.47834464687655,4304,Clear
5479.0,Unknown,,,-3.6985296517011745,90.0,30.606728248818555,52.25041605146606,5851,Clear
5480.0,2024-01-20T23:00Z,,Winter,12.567209615333176,66.0,19.42829704951014,1.7430978404363806,4898,Storm
5481.0,21/01/2024 12AM,London,Winter,6.20681005930097,,26.202549204305598,6.7215992979686146,9674,Rain
5482.0,21/01/2024 01AM,London,Winter,-4.464580532975124,22.0,40.90012728740904,9.511378792648628,7842,Snow
5483.0,2024-01-21 02:00,,Winter,9.58299326049631,68.0,16.200355190028766,18.570169345411173,432,
5484.0,21/01/2024 03AM,,Winter,,85.0,49.564274029961034,53.96231184234577,5201,Storm
5485.0,21/01/2024 04AM,,Winter,7.34801818723415,67.0,2.1441210391220267,17.25171435527656,355,
5486.0,21/01/2024 05AM,,Winter,14.643047643563108,69.0,27.607598990141007,22.939455466359718,6489,Rain
5487.0,2024-01-21 06:00,,Winter,-2.5739523765264005,92.0,20.979916622973192,33.796919051879115,6849,Rain
5488.0,2024-01-21 07:00,London,Winter,14.364925578364062,86.0,11.876490296254644,51.398637062314904,2752,Storm
5489.0,21/01/2024 08AM,London,Winter,8.637039933254833,54.0,12.19626342901049,7.531878932741396,7225,Clear
5490.0,2099-13-40 25:61,London,FoggySeason,-2.9073258557506065,62.0,9.208597318692835,59.61113772878602,,Fog
5491.0,2024-01-21T10:00Z,London,Winter,1.3582787664871283,49.0,30.071180116026923,19.066243573048467,2017,Clear
5492.0,2024-01-21 11:00,London,Winter,7.532305191220443,80.0,41.37497990413173,56.60083082053421,6209,Rain
5493.0,2024-01-21 12:00,London,Winter,2.1434562577614784,56.0,19.256650057558183,16.469221309147386,,
5494.0,21/01/2024 01PM,London,Winter,1.712489594181033,41.0,3.5336591418247467,72.97320462995816,143,
5495.0,21/01/2024 02PM,,Winter,5.606404269613565,88.0,22.28744797868128,34.81945254057269,815,Snow
5496.0,2024-01-21 15:00,London,Winter,6.790202658891523,27.0,28.590958342315382,72.34278659024541,1175,Snow
5497.0,2024-01-21T16:00Z,London,Winter,10.546590219518343,-10.0,45.24316357628598,52.11234092446026,228,Fog
5498.0,21/01/2024 05PM,London,Winter,5.601538851715686,36.0,31.840306250500056,79.67947785835631,3496,Storm
5499.0,2024-01-21T18:00Z,London,Winter,10.111432778376539,78.0,12.433011755332451,24.629283065028993,3335,
5500.0,Unknown,London,Winter,-0.09990013997953895,64.0,2.745704530829207,,4760,
5501.0,21/01/2024 08PM,,Winter,1.802192530967699,30.0,28.92834884775921,54.268558153774045,474,Fog
5502.0,21/01/2024 09PM,London,Winter,-1.4150707909529059,81.0,11.311521251577862,33.068286533238066,5081,Fog
5503.0,Unknown,London,,31.47617703952764,74.0,22.091923030867456,60.9624258630414,9935,Fog
5504.0,2024-01-21T23:00Z,London,Winter,1.2091945514023656,58.0,30.393392014035914,,6412,Snow
5505.0,22/01/2024 12AM,London,Winter,5.5053465029658355,79.0,7.384223516582322,38.23294330927894,7227,
5506.0,2024-01-22T01:00Z,London,Winter,-3.631610380741259,73.0,45.03036727407342,8.209289000162698,9566,Storm
5507.0,2024-01-22 02:00,,Winter,-1.4468215349615776,55.0,4.310902905231395,78.73668345977754,7024,Snow
5508.0,2024-01-22T03:00Z,,Winter,2.815190742204072,83.0,29.935165207644015,32.805160171044776,9892,Storm
5509.0,22/01/2024 04AM,,Winter,6.597897241030106,21.0,37.88018562345042,55.03479352437289,7290,Storm
5510.0,2024-01-15T99:00Z,,,10.154091515279893,63.0,40.23441358548146,56.20611683671144,222,
5511.0,2024-01-22 06:00,,Winter,6.959163174499622,,22.175687782637578,66.68504293395068,6359,Fog
5512.0,2024-01-22 07:00,,Winter,-0.3297671369840067,89.0,1.1694406488313491,52.563405938612824,,Rain
5513.0,2024-01-22 08:00,London,Winter,8.931881051562263,59.0,15.184860995686389,21.151376100353847,712,Rain
5514.0,22/01/2024 09AM,,Winter,12.240051543179064,83.0,40.1888401772956,30.42491343641295,6697,Clear
5515.0,2024-01-22T10:00Z,London,Winter,12.077557866403914,93.0,14.57520511349189,68.88007434764174,,Fog
5516.0,2024-01-22T11:00Z,London,Winter,13.456597748726903,22.0,29.9185091007582,37.39306097125349,8739,
5517.0,2024-01-22T12:00Z,London,Winter,10.652965933253846,75.0,19.465879500765247,30.368688351477342,3784,Fog
5518.0,2024-01-22T13:00Z,London,Winter,,42.0,11.677953233841254,79.45447162124603,8517,Snow
5519.0,22/01/2024 02PM,,Winter,13.435420803413031,33.0,12.723600115776717,7.423538302017665,7876,Rain
5520.0,22/01/2024 03PM,London,Winter,5.121380265946215,92.0,31.725269503891496,65.3608967862356,7782,
5521.0,2024-01-22 16:00,London,Winter,7.908706533330367,74.0,11.487029506201536,38.000468664251805,4617,Rain
5522.0,22/01/2024 05PM,,Winter,8.816502882582657,94.0,157.06430681151,8.222417610496793,50000,Rain
5523.0,2024-01-22 18:00,,Winter,11.331896355877117,67.0,32.47621136835276,34.371216036510404,2288,Fog
5524.0,2024-01-22T19:00Z,,Winter,1.3238946353840086,40.0,48.77050733175049,9.640498341536903,64,Snow
5525.0,2024-01-22T20:00Z,,Winter,-3.8812774551173757,75.0,47.96489845612649,1.686769980807652,4675,Snow
5526.0,2024-01-22 21:00,,Winter,6.228959677493506,150.0,29.6573739092931,14.078335331473353,3695,Storm
5527.0,22/01/2024 10PM,London,Winter,-3.6223411210792933,99.0,29.825407901968386,60.2238250141602,5375,Snow
5528.0,,,,-0.9683014884980956,38.0,17.26094237356432,59.75618331963044,7763,Storm
5529.0,2024-01-23 00:00,,Winter,-0.6501535544481296,54.0,45.38100930625056,,1038,Snow
5530.0,2024-01-23T01:00Z,,Winter,5.959191219945726,41.0,29.128563012277493,79.46426508510243,6342,Storm
5531.0,2024-01-23 02:00,London,Winter,9.105949288741515,80.0,180.0885098810758,12.75923453606202,9335,Snow
5532.0,2024-01-23T03:00Z,London,Winter,8.320037842407892,55.0,14.221578175106252,39.03518892877548,4989,Storm
5533.0,2024-01-23 04:00,,Winter,-1.0458976772072281,74.0,49.8520493789045,29.331964643467074,xxx,Storm
5534.0,2024-01-23 05:00,,Winter,-1.2643191350219762,30.0,33.0228588905672,15.1393727690221,7945,Snow
5535.0,2024-01-23 06:00,,Winter,12.692549505748264,64.0,,,,Fog
5536.0,2024-01-23 07:00,London,Winter,60.0,47.0,40.48058150273073,19.75285881699036,1536,
5537.0,2024-01-23T08:00Z,London,Winter,0.936141431696278,53.0,32.47026310682405,13.057848182264227,7662,
5538.0,2024-01-23 09:00,,Winter,5.053231131786038,81.0,14.915164494020711,4.618347181066893,9268,Rain
5539.0,23/01/2024 10AM,London,Winter,7.611342817876487,35.0,25.05696160197673,5.759654182626157,7681,Clear
5540.0,2024-01-23T11:00Z,,Winter,6.0522704241895315,90.0,36.947908305733215,48.75076494639895,4235,Storm
5541.0,2024-01-23T12:00Z,,Winter,4.601166570675099,-10.0,1.0975763390279336,66.41195125605785,4498,Fog
5542.0,2024-01-23 13:00,,Winter,4.835526784529311,23.0,9.901344416986296,53.56447810666471,1289,Clear
5543.0,2024-01-23 14:00,,Winter,9.343605930932863,78.0,2.1480028441917653,73.26540230105286,,Snow
5544.0,2024-01-23 15:00,London,Winter,-30.0,90.0,25.946917859155622,31.652324682758604,8572,Fog
5545.0,2024-01-23T16:00Z,,Winter,4.178925774292107,55.0,40.39158564658084,,962,Fog
5546.0,2024-01-23 17:00,,Winter,2.1804215833359013,96.0,48.48243351149345,19.31908566208289,906,Fog
5547.0,23/01/2024 06PM,London,Winter,7.662088599706578,90.0,16.902871565696724,49.52745137751811,730,Rain
5548.0,2024-01-23T19:00Z,,Winter,-3.0499288784712886,53.0,3.3978829579700163,71.10518072992502,210,Snow
5549.0,23/01/2024 08PM,London,Winter,10.901543669812524,22.0,13.45478403916634,10.266587859467498,2178,
5550.0,2024-01-23 21:00,London,Winter,10.67497889595857,45.0,20.346485812785442,8.435490826206085,4194,Storm
5551.0,2024-01-23T22:00Z,London,Winter,13.55386293515383,96.0,3.106196781084586,8.111670663642636,4841,Fog
5552.0,23/01/2024 11PM,,Winter,3.545925111366987,99.0,13.334333163506408,3.68257331565105,5103,Rain
5553.0,2024-01-24T00:00Z,London,Winter,5.830564684599288,39.0,28.539025762012148,239.19287254368402,2942,Storm
5554.0,24/01/2024 01AM,London,Winter,7.224654566315213,73.0,27.775265150635004,46.46564541433839,2678,Rain
5555.0,2024-01-24T02:00Z,London,Winter,2.2262407281481593,31.0,34.613012095010134,43.89304383726949,8126,
5556.0,2024-01-24T03:00Z,,Winter,0.33467751595438067,34.0,127.94083200251859,70.97183819508135,1628,Storm
5557.0,24/01/2024 04AM,London,Winter,1.640954551116705,95.0,24.409646023522146,54.80597820934122,5713,
5558.0,Unknown,London,,21.67842378096565,150.0,33.232554667639505,21.138159047397558,,Snow
5559.0,24/01/2024 06AM,London,Winter,6.509301798409567,,46.40191435346591,16.453496407757193,1003,Storm
5560.0,24/01/2024 07AM,,Winter,8.641988041002778,30.0,31.76661598558842,53.66231017450048,5055,Clear
5561.0,2024-01-24 08:00,,Winter,-4.144632006805495,30.0,12.773758061582013,72.8782362901285,,Rain
5562.0,2024-01-24T09:00Z,,Winter,1.7280650815978493,70.0,21.682377830852197,69.3880067858968,7771,Fog
5563.0,2024-01-24T10:00Z,London,Winter,1.2379449001854042,,14.13033584091703,53.93319609874286,2048,Rain
5564.0,24/01/2024 11AM,,Winter,5.819533753107917,24.0,15.386806837062005,27.89146809230859,8999,Rain
5565.0,24/01/2024 12PM,,Winter,,80.0,,19.14467079912913,3250,Storm
5566.0,2024-01-24 13:00,London,Winter,10.615982826218502,31.0,22.661986743437645,21.348815071818656,4325,Fog
5567.0,24/01/2024 02PM,London,Winter,-3.8760553391375008,99.0,25.830116829329025,52.348617130223325,4039,Fog
5568.0,2024-01-24T15:00Z,London,Winter,-1.9664646194462332,33.0,16.242320856237974,69.98783330080602,6378,Clear
5569.0,2024-01-24 16:00,London,Winter,11.909938831929935,71.0,35.342331892033464,43.81028922665941,6377,Storm
5570.0,2024-01-24 17:00,London,Winter,12.426954748296872,,30.341838736703252,65.48198442242264,9359,Fog
5571.0,2024-01-24T18:00Z,,Winter,-4.109625384183069,83.0,32.03537463760309,23.408344511115125,4326,Fog
5572.0,2024-01-24 19:00,London,Winter,4.172502324212903,96.0,39.613990481458046,6.204005125317309,2703,Snow
5573.0,2024-01-24T20:00Z,,Winter,4.001425575373236,36.0,22.130627037295476,58.15779590839378,9776,Clear
5574.0,2024-01-24 21:00,London,Winter,0.971309502373467,84.0,10.738676514708057,,5160,Clear
5575.0,2024-01-24T22:00Z,,Winter,5.009520843043029,59.0,36.865576823194544,21.918269584209682,3186,
5576.0,Unknown,London,,34.949221157897185,80.0,45.86456141815268,75.96554770145438,9782,Clear
5577.0,2024-01-25T00:00Z,London,Winter,6.60743450295697,63.0,21.969722412841374,,2435,Fog
5578.0,2024-01-25T01:00Z,,Winter,9.706463350521563,21.0,39.0847555932372,45.69904345129052,3507,Fog
5579.0,2024-01-25 02:00,London,Winter,5.172244196389915,66.0,33.27853415915393,42.97821878549537,9739,Storm
5580.0,2024-01-25 03:00,,Winter,60.0,61.0,41.604270704556164,35.72927247527842,1335,Fog
5581.0,2024-01-25 04:00,,Winter,-4.912378320322459,-10.0,28.29460224286329,,7993,Clear
5582.0,2099-13-40 25:61,London,Winter,-2.2856860061283313,63.0,33.25399394268192,49.561199791907356,9928,Snow
5583.0,2024-01-25T06:00Z,London,Winter,5.834936555676078,25.0,40.45280569134045,40.6219368667294,6656,
5584.0,2024-01-25T07:00Z,,Winter,11.758669018878432,73.0,10.852792793638628,22.848537955490773,7534,
5585.0,2024-01-25T08:00Z,,Winter,,,11.253026464980298,68.54655845005546,7876,
5586.0,25/01/2024 09AM,,Winter,1.2003923321748955,93.0,5.330947454406553,278.00792158526633,2602,
5587.0,25/01/2024 10AM,,Winter,4.887548697309343,44.0,,40.0917853422572,,Clear
5588.0,2024-01-25T11:00Z,,Winter,1.8234008572212286,80.0,15.779766872641721,36.91881394944716,6295,Clear
5589.0,25/01/2024 12PM,,Winter,-0.4380413717623739,96.0,,56.75306802461519,5898,Clear
5590.0,25/01/2024 01PM,London,Winter,14.160380907264443,87.0,38.441750860228005,75.95145968984419,3795,Clear
5591.0,25/01/2024 02PM,London,Winter,4.247491141026918,150.0,39.19436462244967,18.78483722849466,893,
5592.0,25/01/2024 03PM,London,Winter,14.285921136001882,89.0,8.409451785000698,12.767699245868496,,
5593.0,2024-01-25T16:00Z,,Winter,14.28299511006502,21.0,45.92451667136742,44.71421078978925,6311,Rain
5594.0,2024-01-25T17:00Z,,Winter,10.159296017578178,98.0,,67.8680358536965,1419,Snow
5595.0,2024-01-25 18:00,London,Winter,-0.43631877185604573,57.0,14.287997695200112,75.40150422595177,8645,
5596.0,2024-01-25T19:00Z,,Winter,12.54642219119351,22.0,34.45681933756197,55.56135891242797,2931,Clear
5597.0,2024-01-25T20:00Z,London,Winter,10.648712268376283,57.0,36.90705542488038,69.96352596229815,2400,Fog
5598.0,2024-01-25T21:00Z,,Winter,6.378915292240279,27.0,13.530942980212613,276.63797907890114,3465,Fog
5599.0,,,,-4.982688089305722,77.0,49.29742854869642,27.2009182752012,970,Rain
5600.0,Unknown,,Winter,11.379557817787468,44.0,17.620455121326284,20.864169031144108,1461,Storm
5601.0,26/01/2024 12AM,,Winter,-3.4862192467363906,35.0,29.462947134374478,74.34592449637519,5260,Storm
5602.0,2024-01-26 01:00,,Winter,7.834765589351409,29.0,,63.174672504947445,2929,Clear
5603.0,2024-01-26T02:00Z,,Winter,14.754197178923189,-10.0,27.075823921969157,40.818831139660865,3110,Rain
5604.0,2024-01-26T03:00Z,,Winter,0.22414745605655817,20.0,20.60973859058442,13.487918595789523,1651,Storm
5605.0,2024-01-26T04:00Z,London,Winter,9.743318228712305,,40.378798291501525,44.851399182394864,3075,Fog
5606.0,2024-01-26 05:00,,Winter,4.565448490241838,40.0,28.064139622379415,36.485383453939534,1609,Storm
5607.0,2024-01-26 06:00,,Winter,1.4682599563296872,68.0,30.138217391189677,26.866685795303155,1547,
5608.0,2024-01-26T07:00Z,,Winter,14.989902040482232,99.0,28.710278035440805,73.39993322160613,8135,Snow
5609.0,26/01/2024 08AM,London,Winter,-4.114043816778681,85.0,19.74828999240657,53.73626152676987,1684,Clear
5610.0,2024-01-26 09:00,,Winter,5.565705415095664,46.0,5.050033866631115,52.316179998010966,3820,
5611.0,26/01/2024 10AM,London,Winter,-4.200568084155185,73.0,19.678890437841424,26.99011328133489,6944,
5612.0,26/01/2024 11AM,,Winter,8.587558586900677,28.0,42.112850135634176,48.05117595032209,xxx,
5613.0,2024-01-26T12:00Z,,Winter,-1.1867143902517752,89.0,13.838694466334934,41.601478042476955,6233,Rain
5614.0,2024-01-26T13:00Z,London,Winter,1.9387938090186658,29.0,33.81089418688647,49.16647006991439,7122,
5615.0,26/01/2024 02PM,,Winter,7.373087797658954,59.0,20.0681470346747,49.711506148633234,9872,Storm
5616.0,2024-01-26T15:00Z,,Winter,12.64004366551887,44.0,33.989945412795336,15.318192117628548,6215,Fog
5617.0,2024-01-26 16:00,London,Winter,9.998440015231333,31.0,5.6639796408300525,,5065,Fog
5618.0,26/01/2024 05PM,,Winter,10.389853637829356,59.0,34.53729121703059,15.643973990284374,7838,Rain
5619.0,26/01/2024 06PM,,Winter,11.914854011255095,27.0,0.2557037580643018,61.73907978398554,820,Clear
5620.0,2024-01-26 19:00,London,Winter,13.617141575678303,39.0,2.9262897694407988,79.6570284434828,8590,Rain
5621.0,2024-01-26 20:00,,Winter,-1.4329919460420038,92.0,43.57472454833362,22.424320511583346,7869,Rain
5622.0,26/01/2024 09PM,,Winter,10.580942129568708,65.0,4.294486735435809,37.81179362951975,8583,
5623.0,2024-01-26 22:00,,Winter,,45.0,31.489843866359323,1.4581888938423404,7931,Fog
5624.0,2024-01-26T23:00Z,,Winter,8.017858972538484,64.0,121.94867895284064,200.7453307523913,8214,
5625.0,27/01/2024 12AM,,Winter,14.09744471606296,99.0,28.478820551151955,66.64921762043564,2690,
5626.0,2024-01-27 01:00,,Winter,10.728187205265797,67.0,3.091599620931457,68.35028587908832,7875,Rain
5627.0,27/01/2024 02AM,,Winter,13.668962834731758,94.0,36.24419256607301,22.967953846703494,8149,Snow
5628.0,27/01/2024 03AM,London,Winter,10.761527780028219,41.0,47.97702971388358,3.56361427984095,,Rain
5629.0,2024-01-27T04:00Z,,Winter,1.6231464710844046,28.0,48.56194783961135,53.620607226799244,5821,Fog
5630.0,2024-01-27 05:00,London,Winter,-1.6789689117902729,21.0,27.831361552281606,71.7933002016282,4550,Fog
5631.0,,London,,11.048631845633995,99.0,,15.186836992699932,,Clear
5632.0,2024-01-27T07:00Z,,Winter,0.014611014986121162,,11.59655414625309,49.06999356594113,7163,
5633.0,27/01/2024 08AM,London,Winter,11.143749464143621,100.0,4.3475983524795705,,1148,Clear
5634.0,2024-01-27T09:00Z,London,Winter,2.710677909068382,,48.168651131784216,59.08268792115877,8229,Storm
5635.0,27/01/2024 10AM,,Winter,5.863055078790641,68.0,7.651546090799316,43.2848889221685,5152,Snow
5636.0,27/01/2024 11AM,,Winter,13.491212558471535,43.0,0.539681358745342,20.722804202132252,xxx,Clear
5637.0,2024-01-27 12:00,London,Winter,10.085394818417017,98.0,45.79623954848545,8.622542099821509,8712,Snow
5638.0,2024-01-15T99:00Z,,,28.22705143839785,87.0,14.061759110296318,13.021369926101798,368,Clear
5639.0,2024-01-27 14:00,London,Winter,14.113526000176527,62.0,10.986088917487164,1.5494154092494128,4011,Snow
5640.0,27/01/2024 03PM,London,Winter,12.664477469610045,70.0,40.735221417146676,79.88152950027393,8997,Clear
5641.0,2024-01-27 16:00,,Winter,-4.602119846315782,22.0,2.8729680143495475,48.76684715799631,3563,Snow
5642.0,27/01/2024 05PM,London,Winter,-3.5238537035606776,33.0,47.42130239871841,23.669524137607027,6408,Rain
5643.0,2024-01-27T18:00Z,,Winter,-2.8921777839324347,61.0,,76.58732546507034,7265,Snow
5644.0,27/01/2024 07PM,,Winter,-3.3712018896988316,92.0,29.38814229553995,0.7802089644420551,4462,Clear
5645.0,2024-01-27T20:00Z,London,Winter,10.548688907924387,78.0,166.88336762248016,49.40683517094193,2883,Rain
5646.0,2024-01-27T21:00Z,London,Winter,,37.0,2.199411218608427,64.58485544922839,2779,Snow
5647.0,2024-01-27T22:00Z,London,Winter,11.949255715325485,70.0,33.10139563855175,207.12894587745117,8686,Fog
5648.0,2024-01-27T23:00Z,London,Winter,7.399878003989995,58.0,49.678245459874695,35.98458871940704,1804,Snow
5649.0,2024-01-28T00:00Z,London,Winter,-4.381077683430612,56.0,34.0541463573745,72.3056046140552,5344,
5650.0,28/01/2024 01AM,London,Winter,-3.4596995156366894,,38.13832492807837,9.594237090350903,7940,Storm
5651.0,2024-01-28 02:00,London,Winter,9.45545538814282,92.0,37.31403912305958,27.675346060017496,3464,
5652.0,28/01/2024 03AM,,Winter,0.68327924582547,52.0,35.27049635755851,23.029892636749416,8679,
5653.0,2024-01-28 04:00,London,Winter,0.7770581457393426,55.0,7.806921620457253,57.9428052733586,5506,Rain
5654.0,28/01/2024 05AM,London,Winter,-4.836416595449076,58.0,14.433110045078362,4.5588246938301324,2905,Fog
5655.0,2024-01-28 06:00,London,Winter,-4.063980578992914,22.0,29.649610526173465,57.54869297454019,7861,Storm
5656.0,2024-01-28 07:00,,Winter,-3.4437379263459333,,29.360404553935222,47.21062453340771,5662,Fog
5657.0,2024-01-28T08:00Z,,Winter,-0.16569513540202685,,36.904837303170076,76.86470219926738,6608,Rain
5658.0,28/01/2024 09AM,,Winter,14.723909711317358,27.0,21.41393514399474,58.78187552766684,6641,Snow
5659.0,2024-01-15T99:00Z,London,,10.624074187049768,150.0,2.466842435654848,62.38196048233423,2549,Snow
5660.0,2024-01-28T11:00Z,London,Winter,10.035085520724838,26.0,38.909383838732225,23.948766329794886,7865,Storm
5661.0,2024-01-28 12:00,London,Winter,11.745519440808206,45.0,47.38405500745444,75.6156446722042,1223,Fog
5662.0,2024-01-15T99:00Z,,,11.432601851764655,,15.304694723291506,33.247205410594056,5707,
5663.0,2024-01-28 14:00,London,Winter,0.19914558348719424,49.0,44.240622318142805,19.662585060538646,1511,
5664.0,2024-01-28T15:00Z,London,Winter,-3.7678974738820292,92.0,47.45860674559174,21.82372213352054,2387,Fog
5665.0,2024-01-28 16:00,,Winter,4.327554015911643,87.0,34.441120391006905,37.9692706018148,8666,Storm
5666.0,32/15/2024 99:99,,Winter,1.428476211297907,37.0,30.839515511176224,39.557979099394096,8724,Storm
5667.0,2024-01-28T18:00Z,London,Winter,14.137408381632383,37.0,9.757287138393211,37.12012645983455,2673,Fog
5668.0,2024-01-28T19:00Z,,Winter,-1.1105334630309671,72.0,12.956154832762884,21.12718826147016,8515,Rain
5669.0,2024-01-28 20:00,London,Winter,-2.1998890037640173,57.0,15.38401495058413,28.397488090876806,5988,Rain
5670.0,2024-01-28 21:00,,Winter,8.29807767488588,95.0,10.868221475518075,,5597,Storm
5671.0,2024-01-28 22:00,London,Winter,-1.5051575181957166,,0.702271482320671,21.03466564837653,1377,Storm
5672.0,2024-01-28T23:00Z,London,Winter,10.675470178862081,99.0,41.76394613562225,73.40671712272325,4368,Fog
5673.0,2024-01-29 00:00,London,Winter,4.917132914462627,70.0,,70.05332800702132,4840,Storm
5674.0,2024-01-29 01:00,,Winter,12.777069493071252,52.0,2.239072328065922,73.15302400574028,4623,Clear
5675.0,29/01/2024 02AM,London,Winter,10.70679236950321,20.0,121.99830662161219,49.86460796885705,9907,
5676.0,2024-01-29 03:00,London,Winter,11.268250836885404,,8.429389807997428,52.738045209429444,9768,Rain
5677.0,2024-01-29T04:00Z,,Winter,13.243967690265524,93.0,12.17821031704458,41.328346284355966,925,Clear
5678.0,29/01/2024 05AM,London,Winter,-3.017565714945254,44.0,40.47820817410931,61.9176721134447,3237,Clear
5679.0,2024-01-29 06:00,,Winter,4.089002911058092,49.0,28.753592160258222,44.44440595795616,1686,Snow
5680.0,2024-01-29 07:00,,Winter,2.3442987785585645,150.0,16.56158112209078,15.329748101736955,432,Snow
5681.0,29/01/2024 08AM,,Winter,2.0765648354498722,52.0,33.38510931591614,14.448294434455802,9209,Rain
5682.0,2024-01-29T09:00Z,,Winter,12.734818463388763,90.0,6.563699960712411,15.62023589174708,NaN,Rain
5683.0,2024-01-29T10:00Z,,Winter,4.964127331895558,30.0,,67.21498792820204,6881,Snow
5684.0,2024-01-29T11:00Z,,Winter,14.791063172873585,58.0,28.066241071899757,38.86485522279755,5433,
5685.0,2024-01-29T12:00Z,London,Winter,10.608739189572356,80.0,21.88335229437496,20.11690765442305,9974,Clear
5686.0,29/01/2024 01PM,London,Winter,1.6783652209181916,52.0,45.74690714447832,3.6220387804977516,9164,
5687.0,2024-01-29 14:00,,Winter,-0.08443553051552932,35.0,49.174921080576446,2.7218892812899487,9738,Fog
5688.0,2024-01-29T15:00Z,London,Winter,3.474426079925239,68.0,,64.71194700756489,3318,Rain
5689.0,29/01/2024 04PM,London,Winter,4.594014608452056,80.0,31.191289689482854,78.65644619727843,9322,Snow
5690.0,2024-01-29T17:00Z,London,Winter,14.894095265435784,85.0,32.718279410305215,43.31589007978833,4487,Fog
5691.0,2024-01-29 18:00,,Winter,6.941827241767731,42.0,38.25087319245533,32.32840964628277,1295,Rain
5692.0,29/01/2024 07PM,London,Winter,-0.5505481751962238,68.0,33.12598274560646,25.438838358299066,5223,
5693.0,2024-01-29 20:00,,Winter,-0.03743350179417959,21.0,43.9490084199239,31.65037909600774,6667,Rain
5694.0,2024-01-29 21:00,London,Winter,13.805361852828216,38.0,21.41049589636546,59.875959997204895,4740,Rain
5695.0,2024-01-29 22:00,London,Winter,-4.297708340509869,69.0,43.44533416896263,29.23698846916735,6342,Snow
5696.0,29/01/2024 11PM,London,Winter,,30.0,14.617296433814914,4.805593401496546,1040,Clear
5697.0,2024-01-30T00:00Z,,Winter,-1.8389501622443172,32.0,49.490232669366335,30.919881466330573,2047,Rain
5698.0,2024-01-30 01:00,,Winter,13.516812117821807,31.0,11.954230930668652,,1237,
5699.0,30/01/2024 02AM,London,Winter,,53.0,39.914482102706174,27.58775230774865,923,Rain
5700.0,2024-01-30 03:00,London,Winter,14.434644352788325,45.0,6.364805204722757,40.70870795556522,1629,
5701.0,2024-01-30T04:00Z,London,Winter,-0.9916269892813245,-10.0,45.47315636684506,72.51699735125946,757,
5702.0,30/01/2024 05AM,,Winter,6.676598528774647,91.0,22.174078438605488,55.29427413146487,8223,
5703.0,2024-01-30 06:00,,Winter,2.1903627288610172,41.0,23.921764663584565,22.60668708384264,3142,Storm
5704.0,2024-01-30 07:00,,Winter,9.86122922361033,67.0,,280.6110524135167,1099,Snow
5705.0,2024-01-30 08:00,,Winter,-1.4405438881301502,39.0,16.808302899328126,55.6862917054665,1595,Storm
5706.0,2024-01-30T09:00Z,London,Winter,6.9780128387997244,71.0,2.8920155122240496,34.8023950204341,8664,Snow
5707.0,30/01/2024 10AM,,Winter,-30.0,23.0,39.73860394137219,69.02534470725605,6817,Rain
5708.0,2024-01-30 11:00,,Winter,1.5586423008598205,74.0,48.722650247704074,62.48337240302094,4372,Fog
5709.0,2024-01-30 12:00,London,Winter,9.839895269991452,87.0,,61.91250444621673,7577,Clear
5710.0,2024-01-30 13:00,London,Winter,5.295708872536814,86.0,171.6391938111012,39.623278237176,4794,Snow
5711.0,2024-01-30T14:00Z,London,Winter,,41.0,47.748421575904096,13.210922685191742,6148,Clear
5712.0,2024-01-15T99:00Z,London,Winter,5.211741448806324,60.0,39.47140502191045,45.77014162948891,4237,Fog
5713.0,2024-01-30 16:00,,Winter,10.175460275372796,79.0,7.590326793134455,,6538,
5714.0,2024-01-30 17:00,,Winter,8.51877863789574,59.0,40.725373603998875,73.0433703938261,7575,Storm
5715.0,2024-01-30 18:00,,Winter,1.6127876530601686,22.0,2.6129444029408146,262.2603378910891,9755,Fog
5716.0,2024-01-30 19:00,,Winter,-2.354079313309365,35.0,35.11065697777227,9.207134239749273,936,
5717.0,30/01/2024 08PM,,Winter,,46.0,42.70342450408952,53.13632451257924,564,Snow
5718.0,2024-01-30 21:00,,Winter,6.936261248441539,82.0,45.08431272194582,44.94582366279356,NaN,
5719.0,2024-01-30T22:00Z,,Winter,6.351835009824935,,7.182050992020955,70.0345849165899,4405,
5720.0,30/01/2024 11PM,London,Winter,14.092831775536563,58.0,14.38483478225141,223.2577071506496,496,
5721.0,31/01/2024 12AM,London,Winter,-4.924654504047384,64.0,16.793382196189537,19.803303586222796,2133,
5722.0,31/01/2024 01AM,,Winter,,,41.171549301339425,3.379073564298176,256,Rain
5723.0,2024-01-31T02:00Z,London,Winter,7.746577241573295,150.0,35.53526558574245,16.070957237795334,9348,Clear
5724.0,31/01/2024 03AM,London,Winter,14.972506331301755,84.0,29.265678116878934,31.52640824860721,2975,Rain
5725.0,2024-01-31T04:00Z,London,Winter,8.697009051780258,47.0,11.076183027267206,,608,Rain
5726.0,31/01/2024 05AM,,Winter,0.9777755825193051,100.0,31.903839699952574,69.52080382684456,2797,Fog
5727.0,2024-01-31 06:00,,Winter,-3.1135741320705757,76.0,9.015398949488173,62.97929280843946,7319,Clear
5728.0,2024-01-31T07:00Z,,Winter,7.15686926058282,56.0,2.896099525288276,21.095600677283404,8741,Clear
5729.0,31/01/2024 08AM,London,Winter,-0.31745652025033433,58.0,48.695289769146456,78.84024169495456,2813,Clear
5730.0,2024-01-31T09:00Z,London,Winter,9.816987033225091,93.0,19.217986495363665,33.29349052931288,1025,Rain
5731.0,31/01/2024 10AM,,Winter,-1.5455006636851842,100.0,,65.52301095342843,9166,Fog
5732.0,2024-01-31 11:00,London,Winter,-4.80349957280946,51.0,18.64340222236658,28.145712469102165,8138,Rain
5733.0,2099-13-40 25:61,London,FoggySeason,20.040618389206244,70.0,9.921448884981954,10.0065748031039,7148,Storm
5734.0,31/01/2024 01PM,,Winter,-1.6641471006064612,66.0,10.812038500951465,41.26580072032741,7320,Fog
5735.0,2024-01-31 14:00,London,Winter,-1.0236188580964534,34.0,47.732513112607386,8.251790848017704,5396,Storm
5736.0,2024-01-31T15:00Z,London,Winter,-3.704648255403231,31.0,34.88696585531957,76.67176756182735,7161,
5737.0,31/01/2024 04PM,,Winter,-1.7016234890683535,-10.0,19.50100132873188,62.649382424236684,719,Fog
5738.0,31/01/2024 05PM,London,Winter,,41.0,14.063723942282202,8.99244346361777,626,Snow
5739.0,2024-01-31T18:00Z,,Winter,1.1176261973716812,31.0,8.98017932479538,5.582455939026358,7797,Clear
5740.0,2024-01-31 19:00,London,Winter,6.346573216252036,80.0,8.885770113262398,1.5476235381705372,7544,Storm
5741.0,32/15/2024 99:99,,Winter,-1.342707945561885,86.0,5.2751918785238665,72.68769286753138,3073,Storm
5742.0,31/01/2024 09PM,London,Winter,14.387263340986863,46.0,19.202684099058033,19.593198049147908,3630,Fog
5743.0,2024-01-31T22:00Z,London,Winter,12.439340973004779,81.0,27.633309446329722,56.001890615621576,2885,Rain
5744.0,2024-01-31 23:00,London,Winter,,25.0,47.053582848844066,67.37208042931663,8559,Fog
5745.0,2024-02-01 00:00,London,Winter,12.422519611864193,100.0,14.940144358835422,,7564,Clear
5746.0,01/02/2024 01AM,London,Winter,7.645203475510112,62.0,39.46074348440872,42.98600517004144,6994,
5747.0,2024-02-01T02:00Z,,Winter,13.718000336776988,95.0,12.180818546115441,70.73511609500025,1765,Snow
5748.0,,London,,-1.2465117569926276,96.0,29.726788692985412,5.081774883247592,9307,Snow
5749.0,2024-02-01T04:00Z,London,Winter,-0.7939036384015647,55.0,14.245919277894025,248.65372431268324,627,
5750.0,2024-02-01T05:00Z,London,Winter,12.121028697631694,85.0,18.525883853071374,42.79469314405663,3379,Rain
5751.0,2024-02-01 06:00,London,Winter,-0.36148154197432003,,25.665698272009312,39.995576999537015,6149,Snow
5752.0,2024-02-01T07:00Z,London,Winter,-4.221518142644074,71.0,20.06309150311657,15.260511748971322,5487,Snow
5753.0,01/02/2024 08AM,London,Winter,4.658937583586278,,31.352248277757326,64.64362985627854,6730,Clear
5754.0,2024-02-01T09:00Z,London,Winter,2.381836488247653,99.0,6.616105201806094,52.25546864956161,1066,Fog
5755.0,01/02/2024 10AM,London,Winter,5.829244962737645,23.0,18.356041019300516,35.0280193259988,2326,Rain
5756.0,2024-02-01 11:00,London,Winter,12.246503891536296,20.0,2.7846223170459816,5.411376831089081,3041,Storm
5757.0,01/02/2024 12PM,,Winter,-2.849632593527789,20.0,22.997708215007727,23.50022488407575,3490,Fog
5758.0,2024-02-01 13:00,,Winter,60.0,91.0,7.69720894410792,52.524628627534405,4135,Storm
5759.0,2024-02-01T14:00Z,,Winter,9.928210873062358,25.0,43.436366249447374,264.45519116203275,449,Fog
5760.0,2024-02-01 15:00,,Winter,-1.404434293022745,84.0,0.7150181638373665,55.373453456090516,297,
5761.0,2024-02-01 16:00,London,Winter,13.75858312744263,59.0,138.97917312962034,60.28408843287583,2696,Snow
5762.0,2024-02-01T17:00Z,,Winter,12.48070575749901,69.0,21.579679725152857,75.39928349001676,6576,Rain
5763.0,01/02/2024 06PM,,Winter,1.797371990064807,34.0,18.71073157911714,71.96405287799303,5112,Clear
5764.0,01/02/2024 07PM,London,Winter,,63.0,22.85467883925236,,2268,Storm
5765.0,2024-02-01 20:00,London,Winter,4.3702280561149465,91.0,3.7972962887097284,,2623,Clear
5766.0,2024-02-01T21:00Z,London,Winter,-2.3346602392571314,69.0,48.33072090806218,56.832242683908696,9243,Storm
5767.0,01/02/2024 10PM,,Winter,8.708149993682673,56.0,22.935937305296772,42.811901482520305,7709,
5768.0,2024-02-01T23:00Z,,Winter,10.737422035139279,36.0,42.88904603934144,38.934931439991814,2037,Fog
5769.0,2024-02-02T00:00Z,London,Winter,7.8227025064833065,91.0,46.42233875607677,28.869206464839454,4371,Storm
5770.0,2024-02-02T01:00Z,,Winter,14.797092209190286,38.0,,52.941819153093476,5263,Fog
5771.0,2024-02-02 02:00,London,Winter,-2.4669461791186054,67.0,35.29378588879534,,9467,
5772.0,2024-02-02T03:00Z,,Winter,0.5926718307422663,150.0,30.541774859712252,31.484876753894664,8105,Rain
5773.0,02/02/2024 04AM,London,Winter,10.341714720263464,51.0,15.76881267567315,5.631270753451441,3362,Fog
5774.0,02/02/2024 05AM,,Winter,-1.7193444419168458,34.0,43.31893327059608,74.40896731697981,204,Fog
5775.0,2024-02-02T06:00Z,,Winter,0.06116925939846585,75.0,38.16762173048176,61.455963230299915,,Fog
5776.0,2024-02-02T07:00Z,,Winter,7.8151063768039,79.0,18.078105196560713,25.80684045403344,8597,Storm
5777.0,2024-02-02T08:00Z,,Winter,-30.0,24.0,,,5535,Storm
5778.0,2024-02-02 09:00,London,Winter,14.418015982922789,74.0,17.753540163291703,209.69973895476554,1706,Clear
5779.0,2024-02-02T10:00Z,London,Winter,2.0844081947336335,60.0,17.61306665610994,9.566978711452947,2858,Snow
5780.0,02/02/2024 11AM,London,Winter,60.0,64.0,28.41415719471029,57.366226300990704,658,Fog
5781.0,02/02/2024 12PM,London,Winter,,,46.09784318097409,43.48852885029456,,
5782.0,2024-02-02 13:00,London,Winter,-2.532110779213852,53.0,3.98855793386802,41.928806305985674,2802,Rain
5783.0,32/15/2024 99:99,London,Winter,7.250959460177411,23.0,6.17332233400425,40.53362476735913,2210,Clear
5784.0,02/02/2024 03PM,,Winter,13.453805020976489,57.0,24.07825264718436,7.570511328342304,8146,Rain
5785.0,2024-02-02 16:00,,Winter,10.847223977281452,-10.0,164.20451916230294,8.354092145531542,9953,
5786.0,2024-02-02 17:00,London,Winter,7.238774375681491,39.0,11.999038953902502,76.83610588463254,6840,
5787.0,32/15/2024 99:99,London,Winter,10.054356872663465,45.0,2.2500553368826393,34.80738093536586,,Rain
5788.0,32/15/2024 99:99,London,,-0.7292463145125883,51.0,122.09537839693397,62.43690820495799,732,Clear
5789.0,02/02/2024 08PM,London,Winter,60.0,49.0,19.504070564905234,27.04752276982939,7353,Snow
5790.0,02/02/2024 09PM,,Winter,5.20008817981833,29.0,46.82306780477002,250.213913078406,3574,Clear
5791.0,2024-02-02T22:00Z,,Winter,-3.1268174490918033,41.0,13.80311963672171,38.716384345337254,,Fog
5792.0,2024-02-02 23:00,,Winter,-3.0595252754272306,81.0,4.023653410317935,69.13277360992647,9112,Snow
5793.0,32/15/2024 99:99,London,FoggySeason,21.11050438685506,55.0,28.745462423445,24.17955125273381,9659,Snow
5794.0,2099-13-40 25:61,,Winter,4.285303733039489,75.0,30.06588854913483,13.483021458806235,6575,Storm
5795.0,03/02/2024 02AM,London,Spring,19.35021160264266,74.0,24.808502597479276,62.754813016784034,6865,
5796.0,2024-02-03T03:00Z,,Winter,4.584299840386922,69.0,7.599681855546702,38.53198564986642,4052,Clear
5797.0,32/15/2024 99:99,,Winter,1.8832135103914416,87.0,48.44061346078657,56.1401974402075,9574,Rain
5798.0,03/02/2024 05AM,,Spring,10.764756505319678,91.0,0.32165174382974837,26.443895589660478,756,Rain
5799.0,03/02/2024 06AM,London,Spring,12.623680193178911,89.0,,75.50276365928796,685,Clear
5800.0,2024-02-03 07:00,,Winter,-0.16197949432222813,58.0,48.10573685447949,43.0279365521864,2357,Clear
5801.0,2024-02-03 08:00,,Winter,14.729435298809722,34.0,47.30614796432385,57.56053629283158,6075,Clear
5802.0,2024-02-03T09:00Z,London,Winter,-30.0,79.0,3.7564429588017756,70.0774537349949,6329,Snow
5803.0,2024-02-03T10:00Z,London,Winter,,,3.364187559753212,72.06644374494158,6275,Rain
5804.0,2024-02-03 11:00,London,Winter,-4.710781048969814,20.0,23.800686502959394,73.94681349662518,9445,Storm
5805.0,2024-02-03 12:00,,Winter,13.87392622656176,28.0,4.884765754361703,0.6181852666097587,7744,Snow
5806.0,2024-02-03T13:00Z,,Winter,5.412314421453354,88.0,,1.6050776165389902,537,Rain
5807.0,2024-02-03 14:00,London,Winter,-2.6128373747254496,57.0,2.0400272931117347,75.96753817705331,6999,Rain
5808.0,03/02/2024 03PM,,Spring,14.819000495459967,35.0,15.322279174932252,13.193678144336625,3203,Rain
5809.0,03/02/2024 04PM,,Spring,12.838542044397347,26.0,22.68549029410456,16.68998117421662,933,Clear
5810.0,2024-02-03T17:00Z,London,Winter,3.540368076788056,40.0,35.923919511644286,26.37826200119134,8246,Snow
5811.0,Unknown,London,FoggySeason,3.1445570753846006,,35.89581777398812,55.72590098058274,8747,Clear
5812.0,03/02/2024 07PM,,Spring,17.059984997212204,47.0,2.4826774179620092,61.03840922745319,921,Storm
5813.0,2024-02-03 20:00,London,Winter,6.627751591948616,77.0,11.120301266860915,42.82748902122527,3495,
5814.0,03/02/2024 09PM,,Spring,7.425852663666344,37.0,17.56428865914943,16.82488340012395,,Storm
5815.0,03/02/2024 10PM,,Spring,18.38595708462859,67.0,30.849726994351446,7.956148796573936,5150,
5816.0,2024-02-03 23:00,,Winter,9.873350421291603,42.0,25.223555943137054,11.687126338691582,6541,Clear
5817.0,2024-02-04T00:00Z,London,Winter,-0.3427385953995117,100.0,25.616280682845115,40.839126511443666,8392,Clear
5818.0,04/02/2024 01AM,,Spring,18.886240186265987,100.0,32.199826333317965,34.491981692584986,4572,Snow
5819.0,2024-02-04 02:00,London,Winter,1.2233188067664997,48.0,26.250801787215245,74.84589453336422,8764,
5820.0,2024-02-04 03:00,London,Winter,3.50253772469104,51.0,3.3474833602508136,45.67763124750344,5893,Snow
5821.0,2024-02-04T04:00Z,London,Winter,8.783298054830773,56.0,1.3286219661304999,11.471445181444349,8318,Fog
5822.0,2024-02-04 05:00,,Winter,-1.0528613717767565,-10.0,1.0707230298551473,5.794756266017949,9336,Fog
5823.0,2024-02-04T06:00Z,London,Winter,14.488392255581267,70.0,44.81766316992729,226.1736510973656,1302,Storm
5824.0,2024-02-04 07:00,,Winter,4.519407611346914,38.0,20.676039622959546,77.84720568188357,7896,Fog
5825.0,04/02/2024 08AM,London,Spring,13.196496250149416,64.0,6.151512234328344,33.88735168480391,5506,Fog
5826.0,2024-02-04 09:00,,Winter,8.033290014665969,47.0,20.374530084337312,40.66855463277829,2507,
5827.0,2024-02-04 10:00,London,Winter,-3.543589898940118,98.0,39.236620066111385,64.48245197655969,9835,Rain
5828.0,04/02/2024 11AM,,Spring,17.832277507839123,98.0,22.060831047732304,47.778015246976366,1120,Storm
5829.0,2024-02-04 12:00,London,Winter,12.569697248521202,54.0,7.806918915118394,47.57414183866616,50000,Clear
5830.0,04/02/2024 01PM,London,Spring,16.88628288507241,97.0,37.50269279110981,64.43317764464733,7291,Fog
5831.0,2024-02-04 14:00,,Winter,12.990967636682406,21.0,13.423737627464039,71.85016673123741,8625,Fog
5832.0,2024-02-04 15:00,,Winter,-2.480108928418412,85.0,43.23347728974867,57.377304368131675,2118,Snow
5833.0,2024-02-04T16:00Z,,Winter,2.589466195161883,-10.0,20.883539446485656,8.073027484473947,8982,Rain
5834.0,2024-02-04T17:00Z,,Winter,0.605394545784053,67.0,3.58273599527657,,4587,Rain
5835.0,04/02/2024 06PM,,Spring,11.461545415188379,58.0,,55.97604111238627,5255,Clear
5836.0,2024-02-04T19:00Z,,Winter,13.702336355747516,29.0,11.49089461072132,7.369648036031631,xxx,
5837.0,2024-02-04T20:00Z,London,Winter,5.204987398070408,84.0,28.980970490056183,0.5070444934861218,4492,Snow
5838.0,2024-02-04T21:00Z,,Winter,,32.0,36.11170616177066,50.74725105180211,8348,
5839.0,2024-02-04T22:00Z,,Winter,-1.0420147079229958,57.0,48.45795920402104,76.1252058931788,8396,Clear
5840.0,2024-02-04T23:00Z,London,Winter,-3.937425454743011,75.0,10.980261889272718,32.34837835830713,5032,Storm
5841.0,2024-02-05T00:00Z,London,Winter,10.212694236494656,40.0,,3.6186443991791872,5146,
5842.0,2024-02-05T01:00Z,London,Winter,,55.0,46.70733141524242,5.478883278592619,6061,Rain
5843.0,2024-02-05 02:00,,Winter,2.809687177358966,57.0,2.4599953602087,13.107046374196631,6358,Storm
5844.0,2024-02-05T03:00Z,,Winter,13.902274122900959,54.0,12.202191450924389,29.302520181310534,531,Rain
5845.0,2024-02-05T04:00Z,,Winter,-1.638689331880121,30.0,47.48274942804551,7.579768580854891,5406,Storm
5846.0,2024-02-05T05:00Z,London,Winter,6.927686979765877,62.0,35.27066977147211,294.1393138989315,228,Rain
5847.0,2024-02-05 06:00,,Winter,14.211161449955355,45.0,31.138458130540958,47.64881454803226,4968,
5848.0,2024-02-05T07:00Z,London,Winter,-3.3015295623089713,51.0,49.23994837661297,19.466878187658967,9521,Storm
5849.0,2024-02-05T08:00Z,,Winter,7.232458171552551,61.0,39.93019783604255,33.4320955729106,5752,
5850.0,2024-02-05T09:00Z,,Winter,13.28866098950012,45.0,36.729796306579146,60.58161185092668,6992,Snow
5851.0,05/02/2024 10AM,,Spring,18.88846315011784,96.0,21.9835566719294,14.11156063667101,7924,Fog
5852.0,2024-02-05T11:00Z,London,Winter,9.356574905884719,24.0,26.68812101754259,76.26215790460441,8134,Rain
5853.0,05/02/2024 12PM,,Spring,14.23576496838741,83.0,8.52123810571222,64.8380008742074,6722,Fog
5854.0,2024-02-05 13:00,London,Winter,,46.0,25.542521441063222,69.18588623981633,1266,Rain
5855.0,2024-02-05 14:00,,Winter,-3.415500758859553,150.0,42.73724303702621,49.01071920949966,5362,Clear
5856.0,2024-02-05T15:00Z,,Winter,7.264801313979728,72.0,2.4714632783995825,297.8121020397118,xxx,
5857.0,05/02/2024 04PM,,Spring,17.52138734396756,43.0,5.171919005258352,76.84050524760029,4872,Fog
5858.0,05/02/2024 05PM,,Spring,17.844594308582117,43.0,7.939472904224054,20.251222776687,Unknown,Storm
5859.0,05/02/2024 06PM,,Spring,12.470574031257527,64.0,46.276319889319986,8.780842759721343,4424,Rain
5860.0,2024-02-05 19:00,London,Winter,8.950456174752519,65.0,22.351547427948155,47.90326792423628,5973,Clear
5861.0,2024-02-05 20:00,London,Winter,7.105934824864681,71.0,49.14680155763283,11.870585393175475,173,Clear
5862.0,2099-13-40 25:61,,Winter,-2.9906565441657884,72.0,25.38198211647027,54.07111582260153,7098,Fog
5863.0,2024-02-05 22:00,,Winter,12.92689628754119,38.0,30.082501994180216,22.03097414898164,6148,Snow
5864.0,05/02/2024 11PM,,Spring,16.93299195466936,28.0,48.570831210850365,51.11595261832056,404,
5865.0,32/15/2024 99:99,London,FoggySeason,28.96199560861683,57.0,12.650826161525181,53.73711730289691,2633,
5866.0,06/02/2024 01AM,London,Summer,28.36506240982817,40.0,7.807526333993437,58.82623868147773,5714,Rain
5867.0,2024-02-06 02:00,London,Winter,4.961073164172641,51.0,185.11183179090315,39.13767943666065,5995,
5868.0,2024-02-06 03:00,,Winter,0.01571213467155097,150.0,49.25937997461435,58.200216206650026,Unknown,Clear
5869.0,2024-02-06T04:00Z,London,Winter,5.410863642092725,,48.88064605265656,17.96911220958327,4256,Fog
5870.0,2024-02-06 05:00,London,Winter,4.372390383873942,53.0,32.5231850590001,38.839287903073114,6628,Storm
5871.0,06/02/2024 06AM,London,Summer,24.94591987016505,89.0,37.086921110240795,53.72248932184664,8812,Storm
5872.0,2024-02-06T07:00Z,,Winter,12.05217866617486,37.0,44.32366325511384,76.83732077719043,7871,Rain
5873.0,06/02/2024 08AM,London,Summer,22.06970967599225,40.0,14.16227116737241,33.92602343790587,4309,Clear
5874.0,2024-02-06T09:00Z,,Winter,-4.406181067603365,35.0,22.60750213576012,77.95551029657368,6779,Storm
5875.0,2024-02-06 10:00,,Winter,-3.9841601545881744,44.0,126.11336858945087,16.802850609239606,1718,Rain
5876.0,2024-02-06 11:00,London,Winter,,,2.4502711529917343,77.93486815873567,,Clear
5877.0,,London,,1.9103642544286448,29.0,6.832408659748773,31.53711761701933,9038,Fog
5878.0,2024-02-06T13:00Z,London,Winter,13.587984619618897,71.0,26.44406336764138,61.83357645277199,3082,Fog
5879.0,06/02/2024 02PM,London,Summer,34.82036028988129,94.0,6.601929313035715,34.30308153011879,Unknown,Fog
5880.0,06/02/2024 03PM,London,Summer,15.7420719585793,21.0,44.631524698398344,28.188478988693042,5148,Snow
5881.0,2024-02-06T16:00Z,London,Winter,9.233444515144196,57.0,12.884646380316733,66.64235572366155,NaN,Clear
5882.0,2024-01-15T99:00Z,,,34.49811373474666,88.0,44.35672006689254,10.289758120073378,xxx,Clear
5883.0,2024-02-06T18:00Z,London,Winter,4.122544909222661,22.0,0.008687321203471043,30.573844263429617,1766,Rain
5884.0,2024-02-06 19:00,,Winter,7.2424513419053405,53.0,44.25491582743385,21.879544990997246,8404,
5885.0,2024-02-06T20:00Z,London,Winter,1.8716841404466633,20.0,43.54506310429477,11.480440635175375,2150,Rain
5886.0,2024-02-06T21:00Z,London,Winter,-4.455154469434879,81.0,9.170974401282994,59.81644259995227,6913,Snow
5887.0,06/02/2024 10PM,London,Summer,10.483551350324618,71.0,8.434514625299277,8.350249067020243,1914,
5888.0,2024-02-06 23:00,,Winter,9.611036069406456,-10.0,12.351669650629349,38.55660771734924,4798,Storm
5889.0,2024-02-07T00:00Z,London,Winter,11.04124448516308,30.0,35.40190180659186,3.861713809716969,4748,Storm
5890.0,2024-01-15T99:00Z,,FoggySeason,11.21770666096321,88.0,42.64888863070616,74.4348028063881,4539,Storm
5891.0,2024-02-07T02:00Z,,Winter,14.08706788804215,97.0,,37.47951706956588,995,Storm
5892.0,2024-02-07T03:00Z,London,Winter,7.668970843884022,-10.0,32.85539559236783,68.99744859180738,8950,Storm
5893.0,2024-02-07 04:00,London,Winter,4.23944036044648,42.0,25.725053668392896,49.685104251967275,7784,Rain
5894.0,2024-02-07 05:00,,Winter,2.7989373230169594,56.0,36.3942529399645,14.195739522943347,8385,
5895.0,2024-02-07 06:00,,Winter,-0.3136509295489702,23.0,19.166814950864026,33.07150212716504,607,Storm
5896.0,2024-02-07T07:00Z,London,Winter,0.3763540550553639,91.0,21.286693032548854,64.3802410290684,,Clear
5897.0,07/02/2024 08AM,,Summer,,33.0,46.56690532374316,52.79084988145396,9991,Clear
5898.0,2024-02-07T09:00Z,London,Winter,2.2571544399383985,66.0,20.49349351931817,39.672255881400844,xxx,
5899.0,07/02/2024 10AM,London,Summer,31.64125744137639,23.0,13.566405550097166,30.74334309246605,3017,Fog
5900.0,Unknown,,FoggySeason,0.05838251381982129,29.0,10.147818361617327,48.04849279653481,6999,Rain
5901.0,07/02/2024 12PM,London,Summer,20.676751305073623,91.0,32.34446380759053,70.5081377230459,6996,Clear
5902.0,07/02/2024 01PM,,Summer,25.436642984030165,85.0,48.481253419432576,28.389431166190732,9079,Rain
5903.0,2024-02-07T14:00Z,London,Winter,9.40935077981884,71.0,19.431819987656052,32.3652615627784,4554,Clear
5904.0,2024-02-07T15:00Z,London,Winter,-2.975121458398684,92.0,13.871294226109537,16.000806878945106,4706,Rain
5905.0,07/02/2024 04PM,,Summer,25.86648201502942,73.0,42.513722817498746,78.00699693903682,9299,Storm
5906.0,2024-02-07 17:00,,Winter,-3.5253415422681855,52.0,10.716832756173295,38.97818207546039,7009,Storm
5907.0,2024-02-07T18:00Z,,Winter,14.22675860480976,98.0,45.69657322985992,31.247464256296446,5885,Storm
5908.0,2024-02-07T19:00Z,London,Winter,,,30.54852053923075,,1642,Rain
5909.0,2024-02-07T20:00Z,London,Winter,-0.7076839567882516,81.0,4.995679704854394,55.88255954708881,2889,
5910.0,2024-02-07 21:00,London,Winter,1.5593267404235984,50.0,41.433345455205156,,3715,Snow
5911.0,07/02/2024 10PM,,Summer,29.176515709362228,67.0,12.34997218881489,58.630785129127275,6819,Rain
5912.0,2024-02-07 23:00,London,Winter,14.45754177149259,98.0,41.352046419538794,43.065543249696475,693,Snow
5913.0,2024-02-08 00:00,London,Winter,4.283166605641673,27.0,45.57305996819824,60.833999029240275,7382,Fog
5914.0,2024-02-08 01:00,,Winter,-30.0,47.0,26.907729712669102,37.75663280776367,,Snow
5915.0,08/02/2024 02AM,London,Summer,34.645550501784115,43.0,40.15532185033767,267.8173335646371,3817,Clear
5916.0,08/02/2024 03AM,,Summer,20.12025299207548,78.0,156.72619430125349,54.55697248066396,4531,Clear
5917.0,32/15/2024 99:99,London,,15.20002277922515,81.0,29.87682216197959,76.54657473967106,1980,Rain
5918.0,08/02/2024 05AM,London,Summer,24.198403818575166,69.0,2.586293092619546,68.29630114214447,1643,Storm
5919.0,2024-02-08 06:00,,Winter,0.20599113921000267,56.0,19.95069554783848,34.59227716891473,1891,
5920.0,08/02/2024 07AM,London,Summer,25.741087000351477,91.0,23.69109130421043,26.219050017231893,NaN,Clear
5921.0,2024-02-08 08:00,London,Winter,9.584113416020832,49.0,12.284171461319321,37.53991139297618,6005,
5922.0,08/02/2024 09AM,London,Summer,31.231569207690704,83.0,43.287057296323574,13.529767645312027,3410,Storm
5923.0,2024-02-08 10:00,London,Winter,4.938822003978785,85.0,5.853326690397092,51.30964850601586,8585,Storm
5924.0,08/02/2024 11AM,,Summer,13.988833117939025,150.0,26.275485643975312,17.39018622279554,8550,Storm
5925.0,2024-02-08T12:00Z,,Winter,3.582272304566132,86.0,23.157047602103226,17.17253479909499,5918,Clear
5926.0,2024-02-08T13:00Z,,Winter,11.825437856461388,38.0,36.349997655076336,9.948706679966266,529,
5927.0,2024-02-08 14:00,London,Winter,8.937254550259805,69.0,7.566451270398311,76.30164200122069,8481,Snow
5928.0,08/02/2024 03PM,,Summer,24.493257539451264,91.0,41.8093754161342,45.55641681944492,3797,Rain
5929.0,2024-02-08 16:00,London,Winter,6.825734286618664,23.0,11.837760774304318,61.12600464777653,,Clear
5930.0,08/02/2024 05PM,,Summer,28.9056186285146,51.0,12.025974250896255,30.77784932267886,8765,Snow
5931.0,2099-13-40 25:61,London,Winter,,39.0,9.141200449809983,50.23193388915091,5486,Rain
5932.0,2024-02-08 19:00,London,Winter,-0.08610401656065036,84.0,3.670971253537764,27.903103121323287,2656,Rain
5933.0,2024-02-08T20:00Z,,Winter,0.9817909552167343,80.0,49.75836491067987,,7694,
5934.0,2024-02-08T21:00Z,London,Winter,14.321646134733797,88.0,38.842294533156675,57.71558416170977,4976,Clear
5935.0,08/02/2024 10PM,London,Summer,28.18634315746529,35.0,49.364553761029924,41.028533667017264,5289,Fog
5936.0,08/02/2024 11PM,London,Summer,15.276026281074529,31.0,22.34019044130101,72.27446973750888,4412,Clear
5937.0,2024-02-09 00:00,London,Winter,12.663558353639772,99.0,0.0031059591043103296,0.8074187460243287,6435,Clear
5938.0,2024-02-09T01:00Z,London,Winter,2.0104864670325817,23.0,4.200931633851085,0.3339324221144224,3515,Storm
5939.0,2024-02-09 02:00,London,Winter,-3.6281432664440905,90.0,10.394495308827583,72.57128479066638,454,Storm
5940.0,2024-02-09 03:00,,Winter,11.559043010578861,59.0,41.76815343877252,41.32644650604852,9025,Clear
5941.0,2024-02-09T04:00Z,,Winter,3.165791134968533,39.0,1.3863210859096808,,1231,Rain
5942.0,2024-02-09T05:00Z,London,Winter,,61.0,43.208177058736815,46.47765646118708,494,
5943.0,2024-02-09 06:00,London,Winter,14.556910124295044,95.0,49.993494646210756,48.80810288560407,6506,Rain
5944.0,09/02/2024 07AM,,Autumn,3.7361656322155268,47.0,20.484231141216657,40.95311627154408,3224,Snow
5945.0,09/02/2024 08AM,London,Autumn,17.606806166133126,27.0,3.5281733177294217,29.500489065668134,941,Fog
5946.0,2024-02-09T09:00Z,London,Winter,5.596397321657358,57.0,11.935200600051493,18.412470322338137,5832,Clear
5947.0,2024-02-09 10:00,London,Winter,9.642912480968437,94.0,22.709596352506573,8.298911169262855,2264,Storm
5948.0,2024-02-09T11:00Z,,Winter,1.6605016845385272,66.0,9.0592628209132,1.7704154874017863,7352,
5949.0,2099-13-40 25:61,London,Winter,,88.0,41.759658856028395,24.831616597879336,6729,Snow
5950.0,32/15/2024 99:99,London,FoggySeason,-2.4515706952069483,42.0,25.185339387896505,,5573,Snow
5951.0,2024-02-09 14:00,London,Winter,9.492356857375889,55.0,10.102805615632926,1.068793983825227,9372,Rain
5952.0,09/02/2024 03PM,London,Autumn,5.994883905037478,44.0,12.459617753390006,48.197289768799685,570,Rain
5953.0,2024-02-09T16:00Z,,Winter,6.6951675955642,88.0,40.75992489186247,69.21898331084643,7422,
5954.0,2024-02-09T17:00Z,,Winter,8.703996630440402,80.0,29.695790110317226,30.610988832103942,6213,Rain
5955.0,2024-02-09T18:00Z,,Winter,-3.1565265762801475,86.0,44.12138168751934,12.495764274255254,8058,Snow
5956.0,09/02/2024 07PM,London,Autumn,1.7477622939739446,94.0,35.153531709298115,7.968063818801827,6593,Clear
5957.0,09/02/2024 08PM,London,Autumn,7.478396416944562,69.0,19.19932745493243,7.258640909495053,4399,Storm
5958.0,2024-02-09 21:00,London,Winter,3.5721488649125117,100.0,42.414511188801804,48.03613555689196,9738,Snow
5959.0,09/02/2024 10PM,London,Autumn,2.049719197424351,64.0,28.96629657321225,73.04933765735035,7256,Storm
5960.0,09/02/2024 11PM,London,Autumn,11.6030112373432,98.0,,52.70361557054791,9166,Storm
5961.0,10/02/2024 12AM,London,Autumn,4.996802954107382,84.0,,77.1490628328417,9243,
5962.0,2024-02-10T01:00Z,,Winter,3.9974383785054286,61.0,6.9218007434408975,66.88384944152473,8968,Storm
5963.0,10/02/2024 02AM,London,Autumn,0.19126606070293928,50.0,42.90876142548092,18.968456955398167,2723,Fog
5964.0,2024-02-10 03:00,London,Winter,14.53605997201321,75.0,12.4905156416875,51.36711587390025,6409,Clear
5965.0,2024-02-10 04:00,London,Winter,1.8396418410990467,29.0,24.082066152166455,49.53869576634814,2569,Snow
5966.0,2024-02-10T05:00Z,London,Winter,,75.0,15.066910971804276,50.77006661888316,,Snow
5967.0,10/02/2024 06AM,,Autumn,15.413968775814912,76.0,4.305284952327187,74.32204123658452,7362,Snow
5968.0,2024-02-10T07:00Z,,Winter,8.230291951976298,55.0,32.64673324276614,235.8124641786383,7321,Storm
5969.0,2024-02-10T08:00Z,London,Winter,11.423333498860188,22.0,47.842656452121076,20.485220352323168,9381,Fog
5970.0,2024-02-10 09:00,London,Winter,-1.3906408026537598,36.0,5.9794663420269565,20.750844032060094,6137,Clear
5971.0,32/15/2024 99:99,,Winter,14.706913070645207,76.0,24.8312108982838,69.46505958114355,9290,Fog
5972.0,2024-02-10T11:00Z,,Winter,4.3649698875336735,53.0,0.7208405726562728,283.8612679925966,9099,Clear
5973.0,2024-02-10 12:00,,Winter,7.0007321400992595,70.0,38.79623337089455,27.93938981236603,2502,Storm
5974.0,2024-02-10 13:00,London,Winter,-0.9458933301448909,78.0,36.60279074808689,7.553054378420159,3636,Snow
5975.0,10/02/2024 02PM,,Autumn,60.0,24.0,36.03965124975773,39.823358726178085,9599,Storm
5976.0,2024-02-10 15:00,London,Winter,-2.5222049416487224,35.0,5.658460140370991,46.849802611427336,8009,
5977.0,10/02/2024 04PM,London,Autumn,15.747581058718254,-10.0,6.683348941584799,21.68777020008526,9458,Fog
5978.0,2024-02-10T17:00Z,London,Winter,3.365546954492629,82.0,28.460589795944124,13.317785905297432,1992,Clear
5979.0,2024-02-10T18:00Z,London,Winter,12.602104838553906,77.0,21.089609062333913,78.5282880000872,4998,Rain
5980.0,10/02/2024 07PM,London,Autumn,17.6325290366074,89.0,174.5139719381284,43.263078731209674,5276,Clear
5981.0,10/02/2024 08PM,London,Autumn,14.07732561892544,88.0,9.147141299937879,79.75850460249114,547,Fog
5982.0,2024-02-10 21:00,,Winter,3.408662425823781,78.0,4.857117138325185,48.506128550650445,3939,Fog
5983.0,2024-02-10 22:00,,Winter,,92.0,35.15227354671126,6.2546471052408315,888,Snow
5984.0,10/02/2024 11PM,London,Autumn,,79.0,27.37706886475877,74.01050057211117,3178,
5985.0,2024-02-11 00:00,,Winter,4.533660964745547,67.0,12.836516008494097,251.9918251032893,105,Snow
5986.0,,London,,18.269603474382336,51.0,48.754526916659046,69.42584299320744,Unknown,Storm
